text	subject_id
table and entity lesson 25 ocr gcse computing welcome to ocr gcse computing this mooc massive open online course ha been created by the cambridge-based partnership of exam board ocr cambridge university press cup and the raspberry pi foundation the course is based on ocr s gcse computing curriculum and give participant an excellent opportunity to investigate how computer work how they are used and to develop computer programming and problem-solving skill the course ha been designed for 14-16 year old but is free and open to all and can be used either a a course or a resource to support teacher video focus database and the use of data handling software investigate using database management software such a microsoft access develop a broader view of what a database is and appreciate how fundamental they are in many application they use regularly for example supermarket point of sale system etc why it is necessary to store entity in separate table the use of the primary key from one table a the foreign key in another to link them for more information or resource please see the course through ocr mooc or connect with me on edmodo specification reference unit a 4 51 2 1 5 statement e and f	0
may and might for future possibility future form one point grammar lesson 1 10 6 each one point grammar lesson is a ready-to-go package that enables teacher to confidently present a discrete item of grammar to student and immediately check their comprehension with an accompanying activity worksheet lesson are designed to take between 10 30 minute but are flexible and can be combined with other activity a desired this zip file contains everything you need to teach a successful lesson a powerpoint pt presentation on the focus grammar point and a one-page printable worksheet with answer key for practice the powerpoint is ready-made for teacher to present the language in a classroom and contains chart explanation example and image to support understanding of the concept the worksheet is provided in two form a a fixed pdf that can be printed out and used a is and a an editable word document that can be personalized there are a total 351 one point grammar lesson across 3 level 95 lesson are at high beginner cefr a 2 138 at intermediate cefr b 1 and 118 at high intermediate cefr b 2 each lesson is sold separately or the entire collection is available in a single package one point grammar lesson content form a part of a comprehensive grammar course element of success grammar for language learning the course help student learn grammar and remember it it cover the grammar student find when reading academic text a well a the grammar they will need to communicate in english and to write effectively chart and activity all feature authentic corpus-based language based on the 2-billion-word oxford english corpus so that student learn grammar a it is really used	0
solving quadratic equation teacher edition this teacher edition accompanies the following student edition	0
class dojo reward list class dojo website reward list	0
spanish conversation reaction starter connector this vocabulary handout includes vocabulary for reaction or starter and connector including giving reason opinion clarifying extending the conversation expressing disbelief happiness sympathy disgust reconcile exasperation clarify express doubt non interest and answering yes or no question beyond just s and no have student start using these every time you do interpersonal activity when someone say something to them have them express their emotion with one of these expression also get student to state their opinion and extending the conversation student have lot of fun expressing themselves with these expression start using these expression in level 1 to help student build a foundation that will later help them not only in the real world but for the ap spanish exam	1
italian verb tense reference guide or booklet or chart looking for a way for student to have easy access to all the major tense and how to form them this fun reference guide for common italian tense is in the format of a small passport or booklet it includes a reference guide for il pretense imperative il passport primrose imperfection il future semipublic il conditional pretense il trapassport primrose il conditional passport il conjunctiva pretense and il future anterior it come with a student version and answer key and lot of idea for use and practice with verb tense how can i use it a a review of major tense a a reference guide before major assessment a a teaching tool to complete throughout the year a a learning station or learning center who is it for intermediate level italian student student in grade 6- 12 at the end of the lesson student will be able to conjugate verb in il pretense imperative il passport primrose imperfection il future semipublic il conditional pretense il trapassport primrose il conditional passport il conjunctiva pretense and il future anterior includes 11 page of content detailed instruction and idea for use two 16-page booklet student version and answer key	1
math study log i use this with my student to track their studying behavior in 7th math	0
the happy prince educational recreation this is a presentation describing a program that i implemented in the 3rd and 4th grade of a greek primary school it can be used a a guide for all kindergarten through primary school grade this program is implemented in order to make child love reading through pleasant activity based on the book the concept is to divide the story in part and carry out creative and pleasant activity based on these part aim of the program child spend a pleasant and constructive hour they learn to love reading and book through pleasant activity activity we are carried out for two hour each week this wa a two-month program we preferred this book because of it many beautiful picture and it plot which promote art and drama activity there we are 8 meeting during the 5 of them we we are reading the book and implementing activity relevant to the part of the book we we are dealing with each day during the last 3 week we implemented some extra activity that will be described later on you can adapt the number of meeting and the part you will divide the book according to your class need the presentation includes step-by-step guideline of how to carry out the whole program example photo taken during our activity worksheet and useful link in order to enrich your work it is a program that my student loved enjoy	0
plant ecosystems-interdependent relationship an interactive guide exploring the interdependent relationship within a plant ecosystem	0
figurative language in music project student will create their own song play list with example of figurative language in the lyric figurative language in music worksheet can be used prior to the project for student to familiarize themselves with concrete example of figurative language in song lyric	0
agricultural science website hosted on weebly com this academic website is used to both educate and share the curriculum learning experience and educational resource created through my agricultural science course video and graphic are exceptional visual aid to seeing how agricultural science lends itself to daily life	0
using adverbial to explain when where how and why adverb and adverbial one point grammar lesson 3 5 2 each one point grammar lesson is a ready-to-go package that enables teacher to confidently present a discrete item of grammar to student and immediately check their comprehension with an accompanying activity worksheet lesson are designed to take between 10 30 minute but are flexible and can be combined with other activity a desired this zip file contains everything you need to teach a successful lesson a powerpoint pt presentation on the focus grammar point and a one-page printable worksheet with answer key for practice the powerpoint is ready-made for teacher to present the language in a classroom and contains chart explanation example and image to support understanding of the concept the worksheet is provided in two form a a fixed pdf that can be printed out and used a is and a an editable word document that can be personalized there are a total 351 one point grammar lesson across 3 level 95 lesson are at high beginner cefr a 2 138 at intermediate cefr b 1 and 118 at high intermediate cefr b 2 each lesson is sold separately or the entire collection is available in a single package one point grammar lesson content form a part of a comprehensive grammar course element of success grammar for language learning the course help student learn grammar and remember it it cover the grammar student find when reading academic text a well a the grammar they will need to communicate in english and to write effectively chart and activity all feature authentic corpus-based language based on the 2-billion-word oxford english corpus so that student learn grammar a it is really used	0
attraction satisfaction ela in attraction satisfaction student use their favorite amusement park to practice informative reading and writing a data analyst they are writing a report to an amusement park to help them decide on a new attraction to build they read informational and quantitative text about amusement park and consider cost-benefit analysis they then conduct a focus group to gather information before writing their final report to park director the task end with the opportunity to develop informative writing in several different way this performance task ha edition for 9 different amusement park including six flag magic mountain canada wonderland and hershey park	0
wimbledon tennis math project a 5-6 lesson math project for on wimbledon tennis project answer the math question to find out who progress to the next round addition subtraction multiplication division negative number algebraic expression all covered	0
sexism in storm name gender make a difference study show that people react differently to male and female named storm there is more preparation and fear of storm with male name such a victor versus a storm named christina a a result there are serious implication of this unconscious gender bias listen to this public radio story to learn more about this resource this resource feature a real world public radio story listening comprehension question and classroom discussion theme about listen current listen current make it easy to bring authentic voice and compelling non-fiction story to the classroom we curate the best of public radio to keep teaching connected to the real world and build student listening skill at the same time for more information and teaching idea	0
back to school bargain bundle first week activity get everything you need here in this back to school bargain bundle which includes 10 activity you can choose from to use during the first week or so of school to get to know your student and practice ela standard history standard and even career-readiness standard inference narrative writing resume writing time line etc there are 10 activity total adding up to 16 page which include activity such a writing a summer narrative brainstorm and peer edit sheet included creating a personal time line getting to knowing classmate by writing inference and explaining them history of me worksheet and writing a letter a diagnostic essay an i am poem and even a resume to practice career-related writing enjoy and have a wonderful new school year	0
question with how many and how much plus are there and is there there is or there are and pronoun one point grammar lesson 1 6 5 each one point grammar lesson is a ready-to-go package that enables teacher to confidently present a discrete item of grammar to student and immediately check their comprehension with an accompanying activity worksheet lesson are designed to take between 10 30 minute but are flexible and can be combined with other activity a desired this zip file contains everything you need to teach a successful lesson a powerpoint pt presentation on the focus grammar point and a one-page printable worksheet with answer key for practice the powerpoint is ready-made for teacher to present the language in a classroom and contains chart explanation example and image to support understanding of the concept the worksheet is provided in two form a a fixed pdf that can be printed out and used a is and a an editable word document that can be personalized there are a total 351 one point grammar lesson across 3 level 95 lesson are at high beginner cefr a 2 138 at intermediate cefr b 1 and 118 at high intermediate cefr b 2 each lesson is sold separately or the entire collection is available in a single package one point grammar lesson content form a part of a comprehensive grammar course element of success grammar for language learning the course help student learn grammar and remember it it cover the grammar student find when reading academic text a well a the grammar they will need to communicate in english and to write effectively chart and activity all feature authentic corpus-based language based on the 2-billion-word oxford english corpus so that student learn grammar a it is really used	0
ethic ethic idea about research	0
ontario grade 3 reading curriculum expectation flip book flip book of ontario reading expectation grade 3	0
shoah this is a detailed and thorough video about the sensitive issue surrounding the holocaust often picture speak a thousand word and when speaking about atrocity of the past visuals go a long way note the video should be previewed by the teacher and decide whether or not it would be of appropriate use a part of their lesson plan on wwii and the inhumane condition the jewish community of europe suffered at the hand of the nazi world history world war ii the atrocity of war keywords holocaust jew auschwitz poland history war	0
simulation game agenda the simulation game draw inspiration from sid meier civilization® beyond earth using text and image content for educational purpose only it represents a council of human that are to decide the future of the colony on a new planet	0
avoid and time practice sheet key french lesson key for practice with the verb avoid and time see practice sheet for activity	1
nelson mandela inagural address student read nelson mandela speech and answer teacher-made question posting answer on edmond student read other student answer and respond to their answer	0
the rise of islam power point and keynote presentation mr harm ha designed a number of powerpoint and keynote presentation to help student understand history designed by a teacher for teacher this powerpoint focus on the rise of islam this presentation is designed to give them an overview of the development of the islamic religion student will be shown map animation and description of some of the major event surrounding the rise of islam the presentation is totally customizable allowing you to add your own picture graphic and animation to take what we have done even farther it come with presentation note to help you discus the subject and engage them in the event of the cold war at le than $ 5 00 it will save you time and lay the foundation for presentation that help student understand and remember the topic include geography of arabia bedouin culture and pre-islamic arab religion crossroad of trade life of muhammad basic principle of islam included in the presentation package keynote presentation power point presentation text edit file of the and presenter note the package is a digital download zip file of these three item go here to learn more	0
nfl stadium football team in nfl stadium student use architectural data of an nfl stadium to practice calculating scale similarity and area a well a designing their own scale model a model maker they have to design a replica of a stadium for an nfl team this performance task ha different edition for all 32 nfl team	0
english actfl proficiency level poster actfl s can-do statement help learner identify what they need to do to function at a specific level of proficiency but how can we make these clear and evident for student these poster are a great way to make these benchmark visible for student whether you re a veteran or just newly transitioning to proficiency-based curriculum these poster are a fantastic addition to your classroom how can i use it -post these poster around the room to help integrate curriculum and student buy-in -explain proficiency expectation to students-print for student at the beginning of a lesson or unit who is this for -k-12 world language students-esl ell and eld student includes -85 page of content-a chart of ncssfl-actfl global can-do benchmark version in color and black and white -a poster of the pyramid-style actfl proficiency scale version in color and black and white -10 individual proficiency-level poster in two style option these poster include the can-do statement for each mode presentational speaking interpersonal communication presentational writing interpretive listening interpretive reading from level novice low to superior version in color and black and white	1
larger than life creating larger drawing using a graph this lesson is a follow up to the introduction to drawing in drawing easy a 1 2 3 using the same thinking process for focusing on line student will learn to enlarge a drawing by using graph a brief history of two renaissance artist use of graph will introduce the lesson standard 1 2 line 3 1 observation 3 3 drawing 4 2 4 3	0
assessment of basic math skill fully editable in word format an assessment for basic math skill including counting money identification fraction calendar knowledge and computation this assessment is easily personalized in aspect of computation graphing and time a question can be created to match the level of the student	0
polynomial multiplication involving binomial and trinomials polynomial multiplication involving binomial and trinomials demonstrates how to use multiplication on two polynomial this resource is from the ck-12 library	0
multiplication and division fact family video this is a short goanimate video explaining the relation of fact family to multiplication and division	0
computer game for spanish spanish game on line	1
technology workbook middle school focus this is a packet designed for a middle school technology classroom most lesson can be modified if you do not have the program or software included syllabus for technology the bill of right powerpoint project create a math trivia game power point hyperlink project go animate newscast current event email your senator famous american inventor informational video frame animation poetry video scratch animated name project pocahontas movie letter to disney the colonization of mar create a brochure in microsoft publisher the colonization of mar create a website on google site the colonization of mar create a video advertisement in i movie or window movie maker summer qr code project snowflake qr code project spring qr code project valentine day qr code project poetry project using frame program informational planet brochure microsoft publisher the battle of lexington mystery in history 5 paragraph essay atomic bombing of japan mystery in history 5 paragraph essay cherokee removal mystery in history 5 paragraph essay	0
collecting student work art teacher assigns tag digital camera to collect art student project in a class board	0
fitness around the world data sheet for fitness game	0
booknotes for the crucible about studymode studymode is the world largest learning community for student we we are founded in 1999 on the idea that learning is mean to be social we have built a platform for student to find to create and to share over 100m flashcard and 2m research document on common school subject studymode book note maybe you missed a class or maybe you just can not quite comprehend stream of consciousness style either way studymode com ha you covered when it come to free book note on the most widely read book in high school and college curriculum the crucible book note provide professionally written book summary including character plot summary analysis of major theme and a discussion of important theme and symbol you will also find quiz discussion question and suggested reading list to enhance your understanding of the material	0
samurai facebook page powerpoint template student will have fun researching samurai and creating a facebook page for a samurai using this 3-slide template including category such a friend like favorite weapon virtue code of bushido and more student can use this group of website for research check out some of my student example here on my class blog	0
fantastic mr fox vocabulary and resource link this document includes chapter vocabulary and resource link or project for fantastic mr fox	0
trait of personality individual pair or group activity to work on personality elementary and per intermediate	1
asteroid impact engineering design challenge in this adaptation of the asteroid impact from teachengineering or student design and build a system of underground cavern to house people and necessary supply to survive an extinction level asteroid impact a student participate in this unit they gain experience in the following ng standard ms-ets 1 -1 define the criterion and constraint of a design problem with sufficient precision to ensure a successful solution taking into account relevant scientific principle and potential impact on people and the natural environment that may limit possible solution ms-ets 1 -2 evaluate competing design solution using a systematic process to determine how well they meet the criterion and constraint of the problem ms-ets 1 -3 analyze data from test to determine similarity and difference among several design solution to identify the best characteristic of each that can be combined into a new solution to better meet the criterion for success furthermore student need to analyze type of soil data meeting ng standard ms-ess 2 -3 analyze and interpret data on the distribution of fossil and rock continental shape and sea floor structure to provide evidence of the past plate motion	0
simple past of be positive and negative statement simple past one point grammar lesson 1 8 5 each one point grammar lesson is a ready-to-go package that enables teacher to confidently present a discrete item of grammar to student and immediately check their comprehension with an accompanying activity worksheet lesson are designed to take between 10 30 minute but are flexible and can be combined with other activity a desired this zip file contains everything you need to teach a successful lesson a powerpoint pt presentation on the focus grammar point and a one-page printable worksheet with answer key for practice the powerpoint is ready-made for teacher to present the language in a classroom and contains chart explanation example and image to support understanding of the concept the worksheet is provided in two form a a fixed pdf that can be printed out and used a is and a an editable word document that can be personalized there are a total 351 one point grammar lesson across 3 level 95 lesson are at high beginner cefr a 2 138 at intermediate cefr b 1 and 118 at high intermediate cefr b 2 each lesson is sold separately or the entire collection is available in a single package one point grammar lesson content form a part of a comprehensive grammar course element of success grammar for language learning the course help student learn grammar and remember it it cover the grammar student find when reading academic text a well a the grammar they will need to communicate in english and to write effectively chart and activity all feature authentic corpus-based language based on the 2-billion-word oxford english corpus so that student learn grammar a it is really used	0
music is poetry student use their favorite music to better understand literary element including personification hyperbole and metaphor	0
the big aquarium this is a free preview of a full-length video visit the tennessee aquarium the largest fresh water aquarium in the world i have always appreciated that this series doe not dumb it subject matter down the big aquarium is no exception shot on location at the tennessee aquarium this feature is entertaining and educational unlike many kid program there are no human in goofy costume no singing and no precious moment the animal are the star they are not sensationalized a the world deadliest or amazing killing machine just a fascinating creature from around the world my son loved this when he wa four and five year old and he actually we watched it over and over customer review the big aquarium is part of the award-winning big adventure series from little mammoth medium	0
introduction to f x notation using domain and range assignment that practice how domain range and f x notation come together	0
graph using slope-intercept form an explanation of the concept this video provides an explanation of the concept of graph using slope-intercept form this is a resource from the ck-12 library	0
first german lesson learningapps or is a web 2 0 application to support learning and teaching process with small interactive module	1
