text	subject_id
explore xbox production process explore phase of a pbl unit for linear programming	0
printable color puzzle game spanish this is a simple fun and interactive game to help earner practice their vocabulary in a fun and dynamic way they have to work together and compete against other team to put a puzzle back together and the only way they can do it is by practicing vocabulary how can i use it -as a fun review activity to do in pairs-as a way to practice color for new learners-as a learning station or learning center who is it for -novice level spanish students-students in grade 6-12 includes -2 page of content-detailed instruction and idea for use-printable puzzle cut and go	1
using the passive in speaking the passive one point grammar lesson 3 4 7 each one point grammar lesson is a ready-to-go package that enables teacher to confidently present a discrete item of grammar to student and immediately check their comprehension with an accompanying activity worksheet lesson are designed to take between 10 30 minute but are flexible and can be combined with other activity a desired this zip file contains everything you need to teach a successful lesson a powerpoint pt presentation on the focus grammar point and a one-page printable worksheet with answer key for practice the powerpoint is ready-made for teacher to present the language in a classroom and contains chart explanation example and image to support understanding of the concept the worksheet is provided in two form a a fixed pdf that can be printed out and used a is and a an editable word document that can be personalized there are a total 351 one point grammar lesson across 3 level 95 lesson are at high beginner cefr a 2 138 at intermediate cefr b 1 and 118 at high intermediate cefr b 2 each lesson is sold separately or the entire collection is available in a single package one point grammar lesson content form a part of a comprehensive grammar course element of success grammar for language learning the course help student learn grammar and remember it it cover the grammar student find when reading academic text a well a the grammar they will need to communicate in english and to write effectively chart and activity all feature authentic corpus-based language based on the 2-billion-word oxford english corpus so that student learn grammar a it is really used	0
graph in the coordinate plane a sample application this video demonstrates a sample use of graph in the coordinate plane this resource is from the ck-12 library	0
kahoot english grammar quiz for elt or efl	1
design a book cover assignment student design their book cover keeping in mind colour image and font that represent the story package includes outline of cover assignment about the author write up outline rubric it is a creative way for student to represent their idea about their own story or story they have read thank you so much for your support and interest i hope you enjoy this resource please feel free to use it and improve it i m sure there are even more creative way it can be utilized so feel free to adapt it let me know what you came up with at or on instagram disbelieving this resource is intended for the purchaser to use within their personal classroom the fancy detail are below but you know how it is share with your student but send me being miss b a shout-out whenever you can grab my button at my blog	0
webcast and handout for teaching student how to use gimp this link will lead you to a web cast and handout for teaching student how to use gimp we used gimp to create gorgeous page for our school yearbook	0
science fair display board visual example of a science fair display board based on illinois junior science academy ouija rule i found it difficult to find an example for my student that had all the requirement i made my own example and will share with my student a a possible layout format form -- the abstract safety and endorsement form are stacked on top of each other at the top so the viewer can lift the page to access all of them this save space on the board for other material	0
spanish verb tense reference guide or booklet or chart looking for a way for student to have easy access to all the major tense and how to form them this fun reference guide for common spanish tense is in the format of a small passport or booklet it includes a reference guide for the pretense future simple imperative preterit and imperfect pluperfect preterit perfect future conditional subjunctive and future computes it come with a student version and answer key and lot of idea for use and practice with verb tense how can i use it a a review of major tense a a reference guide before major assessment a a teaching tool to complete throughout the year a a learning station or learning center who is it for intermediate level spanish student student in grade 6- 12 at the end of the lesson student will be able to conjugate verb in pretense future simple imperative preterit and imperfect pluperfect preterit perfect future conditional subjunctive and future computes includes 11 page of content detailed instruction and idea for use two 16-page booklet student version and answer key	1
career engineering ii this play list is for middle school student student work on the play list is self-directed and is intended to be assigned during the school break to encourage engagement and exploration of a potential career path in engineering	0
volcano powerpoint this engaging and vivid presentation cover the type of volcano and includes a web link to a cool volcano site	0
common spanish verb common spanish verb	1
random act of christmas kindness challenge board challenge your student or your own child to complete the rack activity on the challenge board during the time leading up to christmas	0
vocaroo recording embed format doe not support html 5 but it provides qr code	0
french vocabulary part of the human body crossword this pictorial crossword on part of the human body le party dew corp is for teacher and student alike who are interested in teaching or learning french direction fill in the grid with the corresponding french word for the 15 numbered part of the body based on the given image	1
destroyer a verb conjugation game practice conjugating any tense spanish this communicative game ha student conjugating verb and speaking to each other in the target language use it to practice with conjugating in any tense great to add to a lesson or a a review activity after playing student will feel confident about conjugating and even have fun in the process includes game and instruction how can i use it a practice at the end of a lesson on conjugating in a specific tense- a a review for student who have learned a tense in another course or lesson a a learning station or learning center who is it for student learning french or italian or spanish- student at any level student in grade 6-12at the end of the activity student will be able to -conjugate with confidence and ease includes -2 page of content-detailed instruction and idea for use-printable boardgames	1
self-assessment scale for student reflection chili pepper this fun self-assessment scale with chili pepper is a great way for student to reflect and self-evaluate how they are doing in their own learning how can i use it -attach to any lesson on activity-laminate and add to student desk for a quick check-in with this activity student will be able to -easily self-reflect on their learning-think about what they need to move to the next level of comprehension includes -1 page of content-detailed instruction and idea for use-self-assessment scale	1
fun economics growth question this is a series of testing question to stretch top student on the subject of economic growth	0
fun writing activity you make your student do work	0
french le art l esthétique de dalí for this activity student will interpret surrealist painting and a surrealist film by salvador dalí they will produce a piece of presentational writing based on the film	1
using er or more or le with adjective and adverb comparison one point grammar lesson 2 13 3 each one point grammar lesson is a ready-to-go package that enables teacher to confidently present a discrete item of grammar to student and immediately check their comprehension with an accompanying activity worksheet lesson are designed to take between 10 30 minute but are flexible and can be combined with other activity a desired this zip file contains everything you need to teach a successful lesson a powerpoint pt presentation on the focus grammar point and a one-page printable worksheet with answer key for practice the powerpoint is ready-made for teacher to present the language in a classroom and contains chart explanation example and image to support understanding of the concept the worksheet is provided in two form a a fixed pdf that can be printed out and used a is and a an editable word document that can be personalized there are a total 351 one point grammar lesson across 3 level 95 lesson are at high beginner cefr a 2 138 at intermediate cefr b 1 and 118 at high intermediate cefr b 2 each lesson is sold separately or the entire collection is available in a single package one point grammar lesson content form a part of a comprehensive grammar course element of success grammar for language learning the course help student learn grammar and remember it it cover the grammar student find when reading academic text a well a the grammar they will need to communicate in english and to write effectively chart and activity all feature authentic corpus-based language based on the 2-billion-word oxford english corpus so that student learn grammar a it is really used	0
viola interactive learning file this file wa originally created in smartnotebook and is also available via smartexchange if you would like access to the smart notebook file connect and message me	0
conservation and the race to save biodiversity discover the wealth of option available in the vital race to protect biodiversity to learn more about this course and the california academy of science please visit	0
ultimate basketball multiplication 12x basketball team in the ultimate sport multiplcation series student use real data from their favorite sport and player to practice time table	0
subject pronoun dice and spinner for verb conjugation practice and game italian this download come with two product a subject pronoun dice and spinner these make it fun and easy to practice conjugating verb in any tense now any tedious verb exercise is turned into a game or into a speaking or writing activity how can i use it -for whole class activity and games-in group or partner practice activities-on it own or with an existing lesson or activity-as a learning station or learning center who is it for -students learning italian at any level-students in grade 6-12after using this activity student will be able to -conjugate verb in any tense for any subject with confidence and ease includes -3 page of content-detailed instruction and idea for use-ideas for game and activity to practice verb conjugation-subject pronoun dice-subject pronoun spinner	1
spanish vocabulary festival and life event crossword puzzle this pictorial crossword on festival and life event la celebration y loch accompaniment de una diva is for teacher and student alike who are interested in teaching or learning spanish direction fill in the grid with the corresponding spanish word for the given picture clue answer are included download and have fun	1
go math 1st grade exit ticket chapter 1 addition concept 14 page this essential resource includes an exit ticket for each go math common core 1st grade chapter lesson for quick and easy formative assessment this helpful time saver will allow you to monitor understanding of lesson concept to effectively plan for instruction reteach lesson and your math center student self-assess their understanding using the stoplight scale and indicate their level on the exit ticket file includes exit ticket for each chapter lesson and blank 6 per page anchor chart for display student sized anchor chart for math journal or desk common core aligned macc 1 oa 1 1 macc 1 oa 2 3 macc 1 oa 3 6 be sure to check out my other math resource use custom search math in my shop	0
wonder rj palacio literature investigation wonder by r j palacio is an exceptional novel about the experience of a boy a he embrace the world and the world learns to embrace him born with a physical facial deformity this character truly influence how reader understand and relate to the need of others wonder is a child novel written by r j palacio published on february 14 2012 wonder wa a 1 book on the new york time best seller list and wa also on the texas bluebonnet award master list the following document allows student to practice foundational reading skill a well a encourage interacting with the text on a deeper elev take note of where specific skill in citing evidence from the text or inferring from the author tone are noted key idea and detail cc ela-literacy rl 5 1quote accurately from a text when explaining what the text say explicitly and when drawing inference from the text cc ela-literacy rl 5 2determine a theme of a story drama or poem from detail in the text including how character in a story or drama respond to challenge or how the speaker in a poem reflects upon a topic summarize the text cc ela-literacy rl 5 3compare and contrast two or more character setting or event in a story or drama drawing on specific detail in the text e g how character interact craft and structure cc ela-literacy rl 5 4determine the meaning of word and phrase a they are used in a text including figurative language such a metaphor and simile cc ela-literacy rl 5 5explain how a series of chapter scene or stanza fit together to provide the overall structure of a particular story drama or poem cc ela-literacy rl 5 6describe how a narrator or speaker point of view influence how event are described	0
pedagogy training for teaching secondary english or reading this course is a hands-on experience for student preparing to teach english or reading at the secondary level classroom and field method of teaching respective concept to adolescent are integrated within the course including the skill required for effective teaching of english or reading best teaching practice and english content will be aligned to the language and literacy framework implemented in the bermuda public school system and the cambridge international curriculum for the lower m 1 -m 3 or upper s 1 -s 4 secondary school area to be addressed include professional responsibility classroom learning environment planning instruction assessing achievement and teaching for meaningful learning for all student	0
school supply qr code scavenger hunt for interactive notebook esl or ell or eld this is a 2-hour activity for interactibe notebook that includes a qr code scabenger hunt to learn their vocabulary student must use their device to scan qr code it a favorite in our classroom student also habe fun note to add to their interactibe notebook once they be learned vocabulary there are lot of suggestion for fun game and activity for practice how can i use it a a way to introduce school supply vocabulary to student a a learning station or learning center who is it for novice lebel esl ell eld or french or spanish or italian student student in grade k-12 at the end of this activity student will be able to use and identify vocabulary includes 7 page of content 24 vocabulary word detailed instruction and idea for use qr code scabenger hunt note for interactibe notebook	0
beginning reader unit primarily for beginning reader these ten page provide simple and basic sentence with picture to help beginning reader with decoding sentence fluency and basic comprehension skill	0
school for hotel and tourism in zagreb i have made this flog with my student it is about our school	0
scavenger hunt solving radical equation a 12 station scavenger hunt on solving square root equation	0
linear inequality in two variable an explanation of the concept this video provides an explanation of the concept of linear inequality in two variable this resource is from the ck-12 library	0
among the hidden structured note chapter 21-25 evidence based writing unit to go along with the novel among the hidden student will write a short summary of each chapter they read define vocabulary word using context clue and answer a focus question using evidence from the text these note can use the same focus question graphic organizer a the a long walk to water structured note to help student gather their evidence and make inference	0
slogan matching activity identifying the slogan that corresponds to each company individual pair or group work	1
joy luck club chart to help keep character straight daughter	0
spanish subjunctive note for interactive notebook space and alien themed this set of note us space alien and planet to make an analogy for student to easily understand and conceptualize the subjunctive mood it also help student remember the us and formation of the subjunctive with mnemonic device and fun colorful graphic how can i use it to introduce the subjunctive mood to new student to review the subjunctive mood for student who have seen the content before a a learning station or learning center who is it for intermediate level spanish student student in grade 10-12 at the end of the lesson student will be able to understand and explain the us of the subjunctive mood understand and explain the formation of the subjunctive mood includes 7 page of content detailed instruction and idea for use interactive notebook pop- ups and explanation on the use and formation of the subjunctive mood all the colorful and interactive piece required for student to include in their interactive notebook placement map to see how everything fit together note on subjunctive formation with answer key note on subjunctive use with answer key	1
protecting biodiversity the power of the individual advocate for biodiversity conservation come in all form from single individual to international agency to learn more about this course and the california academy of science please visit	0
50 way to use discovery education 50 great idea on how to use discoveryeducation com in your classroom	0
quien e warm up activity for beginner test your knowledge	1
organelle cell skit student evaluation fun original creative and educational this is an adorable and creative high originality skit lesson on organelles-cells which is very easily modified and adaptable it is aligned to ng and very well-organized and ready to use this activity is good for limited technology and all inclusive saving time for that busy teacher this evaluation sheet may be used by the student audience to evaluate their classmate during the cell skit in three 3 group student are required to identify the cell part being acted out and give evidence of why they believe that to be the cell part that is being demonstrated cell wall cell membrane cytoplasm nucleus vacuole chloroplast and hypochondria this keep the audience engaged in learning a the skit are being presented and reach those learner who learn best through reflection and writing suggested ng application ms-ls 1 -2 from molecule to organism structure and process and cell membrane assessment of the function of the other organelle is limited to their relationship to the whole cell assessment doe and cell membrane assessment of the function of the other organelle is limited to their relationship to the whole cell assessment doe m structure function and information processing and cell membrane assessment of the function of the other organelle is limited to their relationship to the whole cell assessment doe and cell membrane assessment of the function of the other organelle is limited to their relationship to the whole cell assessment doe ms-ls 1 from molecule to organism structure and process and cell membrane assessment of the function of the other organelle is limited to their relationship to the whole cell assessment doe and cell membrane assessment of the function of the other organelle is limited to their relationship to the whole cell assessment doe	0
german vocabulary number part 2 crossword this part 2 crossword puzzle is on german number from 16 to 1 000 000 answer are included	1
abc sketch book i have always wanted to give a drawing assignment a a final for my advance art class so this wa my solution so we created abc book each letter ha a drawing challenge and the student create their own abc book	0
drought increase coffee bean price the drought did not just close down ski resort and impact agriculture it also increased coffee bean price due to a bean condition called coffee disease rust the widespread impact might even have customer at the local coffee chop feeling the price change about this resource this resource feature a real world public radio story listening comprehension question and classroom discussion theme about listen current listen current make it easy to bring authentic voice and compelling non-fiction story to the classroom we curate the best of public radio to keep teaching connected to the real world and build student listening skill at the same time for more information and teaching idea	0
animal speaking card italian this is a fun simple interactive and cooperative game for student to practice with vocabulary by using simple verb construction and vocabulary student move through this speaking card deck and practice listening and speaking at the same time how can i use it -at the end of a unit-as a fun review activity to do in pairs-as a way to practice animal for new learners-as a way to practice asking and answering about others names-as a learning station or learning center who is it for -novice level italian students-students in grade 6-12at the end of this activity student will be able to -use and identify vocabulary includes -3 page of content-detailed instruction and idea for use game guide with speaking prompts-printable speaking card cut and go	1
stem worksheet stem worksheet weekly to support root or stem learning	0
future tense this is a presentation to revise the different future tense in english	0
school supply speaking card french this is a fun simple interactive and cooperative game for student to practice with vocabulary by using simple verb construction and vocabulary student move through this speaking card deck and practice listening and speaking at the same time how can i use it -at the end of a unit-as a fun review activity to do in pairs-as a way to practice school supply for new learners-as a learning station or learning center who is it for -novice level french students-students in grade 6-12at the end of this activity student will be able to -use and identify vocabulary includes -2 page of content-detailed instruction and idea for use-printable speaking card cut and go	1
pupil evaluation potential audit of a course	0
informative writing rubric a rubric to be used with informative essay	0
simolizam prezi about symbolism on croatian	1
parliament limit the english monarchy power point and keynote presentation mr harm ha designed a number of powerpoint and keynote presentation to help student understand history designed by a teacher for teacher this powerpoint focus on parliament limit the english monarchy this presentation is designed to give student an overview of how parliament took step to control the english monarch student will be shown map animation and description detailing these event the presentation is totally customizable allowing you to add your own picture graphic and animation to take what we have done even farther it come with presentation note to help you discus the subject and engage student in the event of english history at $ 4 00 it will save you time and lay the foundation for presentation that help student understand and remember the topic include absolute monarchy james i charles i charles ii james ii petition of right parliament english civil war oliver cromwell puritan restoration glorious revolution constitutional monarchy number of slide 41 keynote presentation power point presentation text edit file of the and presenter note the package is a digital download zip file of these three item mcdougal littel world history pattern of interaction absolutism to revolution central european monarch clash chapter 21 section 5 parliament limit the english monarchy go here to learn more	0
primary source winston churchill we shall fight them on the beach winston churchill make one of the most powerful speech ever made during wwii a germany is attacking great britain this primary source allows for the analysis and synthesis of primary source informational text thus student will be able to fully debate the text using historical context and purpose we shall go on to the end we shall fight in france we shall fight on the sea and ocean we shall fight with growing confidence and growing strength in the air we shall defend our island whatever the cost may be we shall fight on the beach we shall fight on the landing ground we shall fight in the field and in the street we shall fight in the hill we shall never surrender winston churchill	0
