text	subject_id
compare and compute around the school in compare and compute student use location around the school to practice measuring item in inch and comparing their length when they finish they can repeat the activity using a different school location and measuring and comparing different object this essential ha different edition for 4 different school area including the cafeteria pe class and even their school desk	0
layer of the earth 5th grade this resource will help student review the layer of the earth crust mantle inner core outer core	0
golden gaming ela in golden gaming student use their favorite game console to practice informative reading and writing in a real world context a human resource manager they have to write an informative job ad to hire new video game developer they read informative text about video game developer and interpret information presented visually they then come together in group to finalize their job description before writing them the task end with the opportunity to develop informative writing in several way this performance task ha edition for 9 different gaming console including game boy wii and xbox 360	0
teachme math missile the math war have begun answer math question correctly to launch missile and destroy those alien invader math missile is a fun way to practice and reinforce math concept with over 200 different way to practice math using question that are fully aligned with common core state standard a great game to engage student that normally do not like to practice math you will love the result when you see them answering 100 of question without them even realizing it	0
the big submarine preview this is a free preview for a full-length video all aboard the world biggest submarine go behind-the-scenes on a u navy trident submarine this movie is wonderful i teach 4th grade and also have a son serving on a trident submarine the submarine shown on the video i use it a a combined science social study and language art lesson the kid enjoy the science lesson they learn and then are able to use the information they learn to write message and create artwork to send to my son crew before they leave on deployment the language used make learning about life on a submarine easy to understand and all the kid have nothing but positive comment when they are finished viewing the movie they are really concerned about sending the sailor positive message and want to let them know they appreciate what they do a great video and teaching tool customer review the big submarine is part of the award-winning big adventure series from little mammoth medium	0
respiratory system anatomy word search respiratory system anatomy word search ideal for homework starter activity platform to developing subject further suitable for k 3 k 4 k 5 grade 9 12 igcse gcse a level gce vocational	0
earthcache for anyone who is familiar with geocaching then you might have heard of an earthcache unlike in geocaching where you go out to find a container sign your name and make a trade in a earthcache there are no container to find you use the same technology gps but now you will reach a spot that ha some geological significance once you arrive at the site or site and these are found all over the world there are question that you need to answer one you have answered those question you email your answer to the owner of the earthcache to gain credit for that site the entire activity wa designed by teacher and so there are resource on the website that have been specifically designed by teacher to be used by teacher there is an entire system and society that ha been built around an earthcache which doe also include local national and international event all of the information that you need to find an earthcache or to set-up an earthcache can be found on the geocaching website and on this website a well	0
the age of chivalry power point and keynote presentation mr harm ha designed a number of powerpoint and keynote presentation to help student understand history designed by a teacher for teacher this powerpoint focus on the age of chivalry this presentation is designed to give student an overview of how chivalry developed in europe student will be shown map animation and description of some of the facet of chivalry the presentation is totally customizable allowing you to add your own picture graphic and animation to take what we have done even farther it come with presentation note to help you discus the subject and engage student in the event of chivalry at le than $ 3 00 it will save you time and lay the foundation for presentation that help student understand and remember the topic include glorifying war and love technology of warfare warrior role in feudal society knighthood code of chivalry knight training epic poetry number of slide 21 included in the presentation package keynote presentation power point presentation text edit file of the outline of the presentation and presenter note the package is a digital download zip file of these three item mcdougal littel world history pattern of interaction an age of exchange and encounter european middle age chapter 13 section 4 the age of chivalry go here to learn more	0
travel time in travel time student use tourist destination data to practice representing comparative situation with model statement or equation multi-step comparison word problem and checking answer with estimation a travel agent they explore how multiplication is used to plan a vacation this performance task includes edition for 9 popular you s city including seattle new york and atlanta	0
exploring cultural sustainability global oneness project student view the photo essay mongolia nomad by taylor weidman which highlight mongolian pastoral herder one of the world last remaining nomadic culture in this lesson student explore the concept of cultural sustainability and the nomadic way of life of present-day mongolian pastoral herder reflective writing prompt are also included to demonstrate student understanding of the story access the photo essay at	0
rosetta stone rosetta stone is a site that allows student to learn and practice their spanish through the computer	1
french vocabulary nature crossword this pictorial crossword on nature la nature is for teacher and student alike who are interested in teaching or learning french direction fill in the grid with the corresponding french word for the given picture clue answer are included download and have fun	1
bill of right trivia game want to have a fun time in class while learning try playing a trivia game about the bill of right this game cover all 10 bill of right you will love it	0
finding solution for equation in two variable mr brown a seventh grade teacher call the science museum to find out the cost of taking his class to the omni theater to see a film on the rain forest he receives the following information the cost of a ticket is $ 5 00 plus a $ 2 00 service fee per ticket there are 22 student in his class and he could have anywhere from 22 to 18 student go based on the number of student absent now mr brown ha to do the math to figure out the cost of taking the student to see the film he know that he will have to use some type of an equation and a table to record the cost based on the different number of student that may attend in this concept you will learn to find solution for equation in two variable this is a resource from the ck-12 library	0
tkam double entry diary dialectical journal for to kill a mockingbird chapter 1-31 a full set of nine dialectical journal aka double entry diary for the novel to kill a mockingbird student will choose quote and write analysis and example are given for student to follow this kind of assignment is so awesome because it self differentiates according to student ability at the end of the assignment student will write a because but so statement to practice critical thinking explanation compare and contrast and because and effect document are in word rather than pdf so you can modify change and edit to your heart content	0
big foot doe bigfoot really exist your student will use the story told by several witness to piece together what bigfoot look like they will need both their reading and math skill to complete this task good luck le than strong greater than mathematical domain le than or strong greater than le than span data-sheets-value equal [ null 2 and quot ratio and proportional relationship the number system statistic and probability measurement and data statistic and probability and quot ] data-sheets-user format equal [ null null 513 [ null 0 ] null null null null null null null null 0 ] greater than ratio and proportional relationship the number system measurement and data statistic and probability le than or span greater than le than strong greater than topic le than or strong greater than ratio scale measurement fraction decimal percent graphing scatter plot slope coordinate grid ordered pair y-intercept problem solving le than strong style equal line-height 1 5 greater than grade level s le than or strong greater than le than span style equal line-height 1 5 greater than fifth sixth seventh eighth le than or span greater than le than strong greater than duration le than or strong greater than approximately 1 2 hour le than strong greater than resource le than or strong greater than lesson plan individual powerpoint presentation pdf activity	0
perfect cap uefa in perfect cap uefa student use data of baseball cap to practice calculating circumference and arc length determining a central angle using the law of cosine and determining the length of an arc given it chord and radius a fashion designer for new era they must develop a new line of hat for professional european soccer team this performance task ha edition for 8 different uefa team including arsenal madrid and barcelona	0
jim crow in the 1930s marian anderson and our nation capital in 1939 marian anderson an african-american opera singer wa prevented from singing to an integrated audience at constitution hall at the time washington dc wa a segregated city but did not have the white only sign familiar in the south anderson instead performed an outdoor concert at the lincoln memorial this public radio story describes the controversy over a recent child s book about anderson s concert at the lincoln memorial that showed colored only sign in place in public place you will hear from people living in the capital at the time talk about when the de facto racial segregation that did exist in the city wa exposed when marian anderson wa not allowed to sing in constitution hall about this resource this resource feature a real world public radio story listening comprehension question and classroom discussion theme about listen current listen current make it easy to bring authentic voice and compelling non-fiction story to the classroom we curate the best of public radio to keep teaching connected to the real world and build student listening skill at the same time for more information and teaching idea	0
constitution of malaysia a collection of measure and guideline for regulating the administration of a country	0
expressing happiness based on rle pod cast	0
social study vocabulary lesson religion culture prejudice influence social study vocabulary lesson religion culture prejudice influence created for a 4th grade social study unit on ww 2 and anne frank the student can use the text example and the picture to create their own meaning which they record in their vocabulary book 4 word could take up to 60 minute to cover allowing time for writing meaning and discussion	0
vocabulary card for pumpkin life cycle these vocabulary card can be used when learning about the life cycle of a pumpkin or when learning about pumpkin student have the term or vocabulary word the information or definition and a picture to go along with it vocabulary understanding is developed over the course of time and is a key component of prior knowledge student can benefit from rich vocabulary experience an effective starting point is to create a tip a continually growing anchor wall chart that includes vocabulary term information on those term and picture of the term a word are introduced they are added to the tip the tip provides a constant reference point for student essential skill discus meaning of word and develop vocabulary by reading text essential knowledge skill and process discus meaning of word and develop vocabulary additional resource have student read a book about pumpkin and then complete this 3 2 1 activity	0
bassoon pitch tendency a helpful handout on which pitch naturally have issue on this instrument and how to help solve intonation problem	0
biome review game for biome several question with picture support	0
learning get personal teresa perles edmodocon 2015 for the first time edmodocon will feature a special spanish-language session to highlight teresa perels and her learning get personal differentiating to improve outcome individual presentation the following blog post is written entirely in her native tongue perels teresa ha taught english a a foreign language for 30 year passionate about education and ict she spends hour on line searching for new methodology and tool to enrich student learning and improve their teaching four year ago teresa began using edmodo to release their finding and create activity designed to help student acquire the skill needed to succeed in their field perels present the speech personalized learning scaffolding differentiation to improve individual progress to illustrate how it is addressed and serf the need of each student listen in on how to use technology differentiating your teaching effectively adapt to specific skill reinforce concept and content and provide resource and opportunity for academic practice that are a diverse a your student ¿cuál e el mensa principal we esp era we torso se eleven led discussion espero we bean cosmo loch recurses technologist estes ah para sukarno immunodeficient a difference loch mandamus we el foremost a maestro alumnus e inspirer a torso docent a utilizarloch	0
yes or no question with the present progressive present progressive one point grammar lesson 1 7 3 each one point grammar lesson is a ready-to-go package that enables teacher to confidently present a discrete item of grammar to student and immediately check their comprehension with an accompanying activity worksheet lesson are designed to take between 10 30 minute but are flexible and can be combined with other activity a desired this zip file contains everything you need to teach a successful lesson a powerpoint pt presentation on the focus grammar point and a one-page printable worksheet with answer key for practice the powerpoint is ready-made for teacher to present the language in a classroom and contains chart explanation example and image to support understanding of the concept the worksheet is provided in two form a a fixed pdf that can be printed out and used a is and a an editable word document that can be personalized there are a total 351 one point grammar lesson across 3 level 95 lesson are at high beginner cefr a 2 138 at intermediate cefr b 1 and 118 at high intermediate cefr b 2 each lesson is sold separately or the entire collection is available in a single package one point grammar lesson content form a part of a comprehensive grammar course element of success grammar for language learning the course help student learn grammar and remember it it cover the grammar student find when reading academic text a well a the grammar they will need to communicate in english and to write effectively chart and activity all feature authentic corpus-based language based on the 2-billion-word oxford english corpus so that student learn grammar a it is really used	0
booknotes for the call of the wild about studymode studymode is the world largest learning community for student we we are founded in 1999 on the idea that learning is mean to be social we have built a platform for student to find to create and to share over 100m flashcard and 2m research document on common school subject studymode book note maybe you missed a class or maybe you just can not quite comprehend stream of consciousness style either way studymode com ha you covered when it come to free book note on the most widely read book in high school and college curriculum the call of the wild book note provide professionally written book summary including character plot summary analysis of major theme and a discussion of important theme and symbol you will also find quiz discussion question and suggested reading list to enhance your understanding of the material	0
no passport required global classroom collaboration in action kathy pittinger edmodocon 2015 before becoming a teacher kathy pittinger earned a bachelor s degree from the university of wisconsin got a master s from the american graduate school of international management and spent 15 year working in international business in the caribbean a lifelong learner pittinger now focus on giving student the tool and strategy they need to explore the world in her 12 year a a gifted and talented elementary teacher pittinger ha continually strives to acquire and apply new skill to enhance student learning during her no passport required global classroom collaboration in action pittinger will show how she us language a an opportunity to give student a new way to express themselves pittinger discus how she translates their world view by pairing bilingual 4th and 5th grader with student in other country and to see project-based best practice that can help increase communication collaboration and cultural awareness in your classroom what s the one thing you hope people take away from your edmodocon presentation i hope they ll be motivated to take risk and try something new i hope they ll encourage their student to explore new world of possibility through collaboration with student from other country and culture i hope they ll discover how diverse amazing and exciting the world is right now and grow to appreciate how rewarding it can be to establish relationship with teacher and student from country other than their own	0
every little step measurement turn your brain into a stair master student will use measurement to analyze the geometry behind the rise and run of step mathematical domain operation and algebraic thinking measurement and data standard grade level 3-6 3 oa a 3 3 oa b 5 4 oa a 2 4 md a 1 4 md a 3 5 md a 1 5 md c 5 b 6 g a 4 topic measurement multiplication repeated addition rate volume surface area spatial reasoning grade level s third fourth fifth sixth duration approximately 1 2 hour resource lesson plan individual powerpoint presentation pdf activity	0
problem-solving strategy graph a sample application this video demonstrates a sample use of graphing a a problem solving strategy this resource is from the ck-12 library	0
virtual aquarium student get to create an environment for fish to see if they can keep them alive	0
engage ny module 1 lesson 9 smatnotebook for engage ny module 1 lesson 9	0
operation with polynomial study guide this study guide look at terminology for monomials and polynomial operation with polynomial foil and special product square of a binomial sum and difference pattern this resource is from the ck-12 library	0
a teacher guide to the holocaust an overview of the people and event of the holocaust through photograph document art music movie and literature	0
german vocabulary country crossword this pictorial crossword on country die l and alum ender is for teacher and student alike who are interested in teaching or learning german direction fill in the grid with the corresponding german word for the given picture clue answer are included download and have fun	1
salt crystal experiment activity of experimentation and research about the mineral crystallization process the aim of this activity is the creation of artificial salt crystal by evaporating water in a saturated solution student will complete a study and will monitor the process of crystal formation and later prepare a report including all research data this activity promotes collaborative work the skill of learning to learn observation and analysis ng alignment ms-ess 2 -1 develop a model to describe the cycling of earth material and the flow of energy that drive this process elesapiens is a collection of digital educational resource in science and the humanity in line with the curriculum for child between 7 and 13 it content combine cartoon and entertainment with quality teaching learning is encouraged through video game experiment and project pbl want more	0
multiplication of monomials by polynomial practice multiplication of monomials by polynomial practice this resource is from the ck-12 library	0
model visualization of atomic quantum number three dimensional physic a a science is a major corner stone in the development of technology that physical theory require a high degree of precision knowledge of physic consists of many of the concept and principle that are generally abstract physic is a subject that requires a relatively high intellect so most student have difficulty studying many difficulty faced by most student is the interpretation of various concept and principle of physic because student are required to be able to interpret the knowledge of physic and it application in daily life properly and not vague or ambiguous this situation is exacerbated by the use of learning method that are le precise physic this research aim to the problem of physic concept and principle of quantum number of atomic model that abstract becomes real and can be perceived by student a a learning experience guiding student visualize model with atomic quantum number in three dimension in the learning process the result of the study are student better understand the concept and principle of three dimensional model of the atom and can put electron configuration in the electron orbit in accordance with the rule	0
13 intro to problem solving video 13 of 17 math teacher circle are professional learning community of middle school math teacher and mathematician our goal is to help middle school math teacher confidently incorporate open-ended authentic mathematical problem solving in their teaching a math session is the heart of any math teacher circle meeting a two-hour session typically focus on an interesting and challenging problem that encourages collaboration among participant with varying skill level and background the video on this page is set up a play list of short clip drawn from a complete math teacher circle session the clip correspond to different activity or segment of the session and have been lightly edited to remove some participant work time and bring the overall length to approximately 1 hour 30 minute per play list each play list includes a debriefing session with participant and is linked to relevant resource including mathematical material from our site the play list is primarily geared for those learning how to plan and lead a math session including leadership team of new math teacher circle and people who have been invited to lead a session for the very first time we also anticipate that they will be useful to experienced session leader who want to learn more about a particular session a well a to anyone curious about math teacher circle in this video joshua zucker julia robinson math festival lead a math teacher circle session titled an introduction to problem solving josh present a problem that seems almost impossibly difficult but teacher discover many way to approach it by considering smaller simpler problem this video wa filmed in summer 2014 when 30 mathematician and math teacher from across the country came to a how to run a math teacher circle workshop at the american institute of mathematics in palo alto ca find material for this session here the 1 to 100 problem tom davis and joshua zucker an introduction to problem solving joshua zucker	0
