text	subject_id
early childhood literary element activity worksheet this book contains ten different worksheet intended for work with literacy at the early childhood level each page is intended to give your student a chance to respond to a story in some way whether it ha to do with the plot the setting the character the problem the solution or the main idea layout and feature of the page are age-appropriate for student who need scaffolding for their emerging printing and writing content include literary element web plot diagram setting quick write and draw problem and solution organizer character quick write and draw the best part wa book cover the main idea reading reflection story retelling organizer if you enjoy this product please be sure to check out my other graphic organizer and reading response resource available at my store	0
what to do when you witness bullying educating child and youth about what they can do when they witness bullying empowers them to act effectively in case when they see this type of mistreatment our module for 5th 11th grade student are filled with student voice that help user learn real action they can take to help those being targeted	0
chinese-pinyin converter chinese pinyin converter	1
heat transfer conduction convection radiation wisc-online is a digital library of web-based learning resource called learning object the digital library of object ha been developed primarily by faculty from the wisconsin technical college system wtc and produced by software and multimedia developer who create the learning object for the on line environment at present over 400 wtc faculty member have authored learning object the wisc-online digital library contains over 2 500 learning object that are freely accessible to teacher and student at no cost and with copyright clearance for use in any classroom or on line application learning object are designed and developed by a team of instructional designer editor technician and student intern learning object are web-based self-contained small chunk of learning learning object are small enough to be embedded in a learning activity lesson unit or course learning object are flexible portable and adaptable and can be used in multiple learning environment and across discipline in this animated activity learner explore three major method of heat transfer and practice identifying each	0
graph of inequality in one variable what if you we are given a linear inequality like y ≥−5 how could you graph that inequality in the coordinate plane after completing this concept you will be able to graph linear inequality in one variable like this one this resource is from the ck-12 library	0
the big rescue preview this is a free preview of the full-length video watch the u coast guard in action see actual footage of the coast guard personnel a they perform rescue at sea land and in the air voyage on a coast guard cutter meet a uscg search and rescue dog and watch rescue swimmer training fly through the air with the crew of a coast guard rescue helicopter and soar over the north atlantic with the international ice patrol a they hunt for giant ice berg entertaining and educational for child and adult alike collect the whole series my 7-year-old son can watch these over and over he first saw one of these at age 4 and still enjoys them customer review the big rescue is part of the award-winning big adventure series from little mammoth medium	0
newspaper project maya aztec and inca student work in group to create a newspaper of multiple different article about the mayan aztec and incan for example a mayan newspaper might advertise chocolate an aztec newspaper may contain an article about hernan cortes taking over the aztec empire or an incan newspaper might contain an obituary for a person who died in an earthquake this product contains 3 page 1 type of article 2 example idea for each type of article for a mayan aztec and incan newspaper and 3 presentation note in this group project student create a newspaper of numerous different article based on the culture and history of the mesoamerica culture the maya the aztec and the inca teacher introduces the project by dividing up the class into group assigning the maya to a third of the team the axtec to a third of the team and the inca to a third of the team student begin by choosing article type page one and topic idea for maya aztec and inca are provided on page 2 student then create their article on paper or on computer powerpoint slide or publisher newsletter advertisement etc including headline informative text and a picture s once student have assembled their team newspaper on large butcher paper or on a powerpoint presentation for example they present their magazine to the class a their classmate take note on page 3 of pdf or separate sheet for more detail i have used this in my 7th grade class and it ha been highly engaging it is a great way to combine language art and world history enjoy history social-science standard for california addressed 7 student compare and contrast the geographic political economic religious and social structure of the meso-american and andean civilization study the location landforms and climate of mexico central america and south america and their effect on mayan aztec and incan economy trade and development of urban society study the role of people in each society including class structure family life warfare religious belief and practice and slavery explain how and where each empire arose and how the aztec and incan empire we are defeated by the spanish describe the artistic and oral tradition and architecture in the three civilization describe the meso-american achievement in astronomy and mathematics including the development of the calendar and the meso-american knowledge of seasonal change to the civilization agricultural system	0
spanish hay poster do your student often forget how to pronounce the word hay or how to use it it s such a useful phrase but very often mistakenly used this simple poster is easy to print and put up in your classroom and can gently remind student how to use hay and how to pronounce it have it posted or print them out a a quick reference while student practice writing or speaking includes poster	1
negative statement with the simple present simple present one point grammar lesson 1 3 3 each one point grammar lesson is a ready-to-go package that enables teacher to confidently present a discrete item of grammar to student and immediately check their comprehension with an accompanying activity worksheet lesson are designed to take between 10 30 minute but are flexible and can be combined with other activity a desired this zip file contains everything you need to teach a successful lesson a powerpoint pt presentation on the focus grammar point and a one-page printable worksheet with answer key for practice the powerpoint is ready-made for teacher to present the language in a classroom and contains chart explanation example and image to support understanding of the concept the worksheet is provided in two form a a fixed pdf that can be printed out and used a is and a an editable word document that can be personalized there are a total 351 one point grammar lesson across 3 level 95 lesson are at high beginner cefr a 2 138 at intermediate cefr b 1 and 118 at high intermediate cefr b 2 each lesson is sold separately or the entire collection is available in a single package one point grammar lesson content form a part of a comprehensive grammar course element of success grammar for language learning the course help student learn grammar and remember it it cover the grammar student find when reading academic text a well a the grammar they will need to communicate in english and to write effectively chart and activity all feature authentic corpus-based language based on the 2-billion-word oxford english corpus so that student learn grammar a it is really used	0
elapsed time lesson 3 this screen cast model critical thinking and analyzing skill needed to solve word problem using elapsed time the peak and hill strategy is shown in this video	0
time qr code want to incorporate technology into your math lesson and have a self checking math workstation there are many free qr code reader available for download to use se an i pad or computer or other device using these card student will read time on the clock to the nearest 5 minute and then scan the qr code to see if they are correct i have laminated mine so that student can use dry erase marker to write on the task card	0
home repair a math project that show student what it take to make home repair measurement pricing and comparing are all a part of this project	0
why biodiversity is distributed unevenly life is abundant on earth but is distributed unevenly with specie richness and population size greater in some area than others the physical environment other organism evolutionary factor and human action all influence where specie live to learn more about this course and the california academy of science please visit	0
element zoo project each semester before the midterm exam my chemistry-1 student must complete an element project the theme change each year	0
verb conjugation game practice conjugating any tense this communicative and cooperative learning board game ha student conjugating verb in any tense and speaking to each other in the target language after playing student will feel confident about conjugating and even have fun in the process how can i use it -as practice at the end of a lesson on conjugating in a specific tense-as a review for student who have learned a tense in another course or lesson-as a learning station or learning center who is it for student learning another language- student at any level student in grade 6-12at the end of the activity student will be able to -conjugate with confidence and ease includes 9 page of content-detailed instruction and idea for use-boardgames with easy-to-understand images-number dice-dice to indicate whether to conjugate a verb in the positive or negative i play v i don t play -dice listing various tense for student to practice conjugating in multiple tenses-subject pronoun dice in italian french spanish a well a a blank dice to use for any language	1
geometry recognize and draw shape from clue this pdf is of a nearpod presentation about shape it will give you a glimpse of what you can expect from nearpod and it capability to enhance your classroom experience via this presentation you and your student will learn how to recognize and draw shape from clue math elementary school age 6 plus	0
plant quest power point bundle with answer sheet and key this a power point which ha plant question coupled with image diagram and photograph student will analyze and possibly discus the slide with partner to answer the question this is a good assignment to follow up a plant unit it also fit in well to flipped classroom and encourages student to talk and use vocabulary from what they have learned topic covered in the question include plant anatomy plant reproduction plant hormone plant tropism and adaptation i have included a separate file with the answer key and answer sheet it is called plant question answer sheet and key there are 25 question total this can be used in any state greater than i live in texas and plant quest aligns with biology tek 10 b you can read about quest power point on my blog	0
spanishlearning this site help student with everything from spanish vocab to spanish conjugation this resource will serve a a separate set of note for student to refer to	1
production of ethanol power point summarizing the 2 main way that ethanol is made	0
recognizing function many thing in the real world consist of a relationship between two thing the number of hour a person work and the amount of money earned the number of gallon of gas bought and the distance a person can drive and the name of the student in a class and their height are just a few example of relationship between two thing this resource is from the ck-12 library	0
estar and preposition of location flipbook spanish interactive notebook this 1-hour activity us a 12-page flip book for student interactive notebook to teach and practice the verb aster and preposition of location it includes all the vocabulary and sentence practice that student need to use these concept correctly and confidently how can i use it -to teach new learner about aster and preposition of location-as a fun review for student who have seen the content before-as a learning station or learning center who is it for -novice level spanish students-students in grade 6-12at the end of the lesson student will be able to -identify preposition of location-conjugate the verb aster for inanimate object includes 7 page of content-12-page flip book and answer key	1
east anglia info sheet a simple annotated information sheet or poster including a map and image about the east anglia region of the uk i very much welcome feedback and advice on my resource and appreciate in advance if such comment we are based on the tested effectiveness of the resource s in a learning environment rather than unsubstantiated commentary thanks east anglia by steve rackley is licensed under a creative common attribution-noncommercial-sharealike 4 0 international license	0
victorian project while reading the importance of being earnest student work in team to research element of victorian society for presentation in class	0
valentine day or día de loch enamorados inb vocab and 4 hour of activity this 4-hour lesson on valentine day or día de loch enamorados includes vocabulary for interactive notebook a well a five different activity to speak write listen and learn how can i use it to teach new learner about demonstrative adjective and pronoun to review demonstrative adjective and pronoun with learner to teach new learner about clothing to review clothing with learner a a learning station or learning center who is it for spanish student at novice level and up student in grade 6- 12 at the end of the lesson student will be able to use valentine day vocabulary answer short prompt about their hope and dream discus a youtube video about dream and opportunity write short message to friend and family discus topic about health compassion and friendship includes 13 page of content detailed instruction and idea for use assessment stamp sheet set up title for activity station interactive note and pocket for vocabulary dynamic vocabulary game valentine day- themed writing craft and activity listening practice with a youtube task dream-catcher to practice speaking and discussing with classmate	1
school supply qr code scavenger hunt for interactive notebook french this is a 2-hour activity for interactibe notebook that includes a qr code scabenger hunt to learn their vocabulary student must use their device to scan qr code it s a favorite in our classroom student also habe fun note to add to their interactibe notebook once they be learned vocabulary there are lot of suggestion for fun game and activity for practice how can i use it -as a way to introduce school supply vocabulary to students-as a learning station or learning center who is it for -novice lebel french students-students in grade k-12at the end of this activity student will be able to -use and identify vocabulary includes -7 page of content-24 vocabulary words-detailed instruction and idea for use-qr code scabenger hunt-notes for interactibe notebook	1
plate tectonics map project rubric this one page printable or deliverable serf a a rubric to evaluate a tectonic plate google map project the file also includes a link to get a copy of the original google document so the rubric can be personalized	0
exploring geologic time-project based learning in this project based learning wix provides student with a creative challenge in analyzing the data of the earth s geologic time scale it meet common core and ng standard for ela career and college readiness mathematics and geologic science given this scale is a representation of the earth s history it organizes earth s history by major change or event that occurred using evidence from the fossil and geologic record the time scale is divided into period based on the order in which different group of rock and fossil we are formed thus student are engaged in analysis of scientific informational text and must integrate this data with career and college readiness skill in synthesis and presentation the creativity student will engage in the role of advertising and marketing for historic time travel most travel agency sell vacation in space that is you move from one place to another spend some time there and then come home this client is different because they sell vacation in time the task a a geologic time expert within the ad agency student research a specific time era complete with a data analysis report to share with the client to present their finding student are directed to create an interactive artifact that accurately illustrates that era of the earth s history	0
the war work hard by dunya mikhail text and question born and raised in iraq dunya mikhail 1965 ha written much about the war she lived through in her home country a a journalist and poet in baghdad her writinf wa considered subversive by former dictator saddam hussein in 1996 she wa forced to flee the country after facinf threat and harassment from the government in this satirical poem the speaker remark on the impressive diligence of war and it effect from provide [ inf ] food for fly to invigorate [ inf ] the coffin maker	0
a visit to the zoo a zip file containing activity power point and chart created with kidpix and printshop please download a viewer if software is not available all activity are based on the ebook a visit to the zoo included	0
snowman shuffle student will practice addition and subtraction fact in this fun game roll three dice add the two highest number subtract the remaining number cube place your marker on that number if the number is already covered you lose your turn	0
exploring the creative process global oneness project student watch a film silent crescendo by emmanuel vaughan-lee about an artist who paint with tea and ink the film is a intimate portrait of an ex-yugoslavian who follows a daily ritual of creating simple drawing in this lesson student explore the creative process and discus what individual and society gain from living a creative life reflective writing prompt are also included to demonstrate student understanding of the story access the short film at	0
travel lesson map and direction this travel lesson includes a 1-hour lesson intended to give student contextual and meaningful practice with asking for giving and following direction this lesson is part of a five-lesson travel unit you can buy it here this lesson includes a detailed vocabulary list followed by authentic contextual activity to give student real-world practice with common travel experience and communication need by the end of the lesson student will feel confident and ready to pick up their passport and go how can i use it -to teach new learner about common travel experience and how to communicate while traveling-to review with student before a class trip-use the unit in sequence or split up the lesson to complete over the course of a year or term-as various learning station or learning center who is it for -novice high spanish students-students in grade 6-12at the end of the unit student will be able to use a map -ask for directions-follow directions-give direction includes -7 page of content-vocabulary list-proficiency-based assessment with stamp sheet-2 communicative activity to practice asking for giving and following direction	1
domain and range of a function domain and range of a function video this resource is a khan academy video	0
4th grade character and plot lesson pack for video supporting cc rl 3 review character or trait element that support plot conflict signpost use with video at clip art courtesy of	0
classroom game on hominid five game on hominid that teacher can use in the classroom to summarize the key feature on the main hominid from australopithecus to homo sapiens sapient these game we are developed for 12 year old student attending a bilingual programme in english that s why they focus on language structure a well a on the content of the subject according to content and language integrated learning clil methodology student can review their knowledge on hominid while practicing reading listening writing and speaking in english my student really had fun i hope yours will too	0
crossword crossword about the godspell italian	1
bullying how can parent help because of the influence that parent and caregiver have on the behavior and belief of their child and their responsibility for their well-being parent play a critical role addressing bullying situation our parent module designed for parent of k-12 student provides caretaker with specific strategy to help them resolve bullying situation	0
national symbol explore this interactive image to learn more about the nation symbol	0
call of the wild chapter 1 powerpoint text and question this is an interactive powerpoint that can be shared with your class via google drive student can make a copy of this set of slide and answer the question a we read a a class or a they read on their own on each slide i have included a section of the text and a sentence starter some slide contain a graphic organizer or an image that will help student better understand the text	0
monarch butterfly life cycle game card primary science this single sheet may be copied onto multiple colored card stock lamination is optional student play in group of one to four turning over one card at a time and connecting it by color to the complete stage of the life cycle connects with ng for kinder first and third grade in life science	0
data structure visualization the best way to understand complex data structure is to see them in action interactive animation for a variety of data structure and algorithm have been developed the visualization tool is written in javascript using the html 5 canvas element and run in just about any modern browser -- including o device like the i phone and i pad and even the web browser in the kindle the frame rate is low enough in the kindle that the visualization are not terribly useful but the tree-based visualization -- bsts and avl tree -- seem to work well enough	0
the magic of water video elesapiens is a collection of digital educational resource in science and the humanity in line with the curriculum for child between 7 and 13 it content combine cartoon and entertainment with quality teaching learning is encouraged through video game experiment and project pbl want more curricular focus of this resource water animation video that explains in simple language and powerful visual image the cycle of water to make the student aware of their individual responsibility in the use of global resource encourages student to ask question and look for answer a a group content are linked transversally to concept developed in other unit ng alignment es 2 -2 describe and graph the amount and percentage of water and fresh water in various reservoir to provide evidence about the distribution of water on earth ms- es 2 -1 develop a model to describe the cycling of earth material and the flow of energy that drive this process ms- es 2 -4 develop a model to describe the cycling of water through earth system driven by energy from the sun and the force of gravity	0
a view from the bridge note note on the key section of a view from the bridge	0
analyzing campaign announcement video a chart for student to record their note from 2016 presidential campaign video announcement	0
multiplying a polynomial by a polynomial a sample application this video demonstrates a sample use of multiplying a polynomial by a monomial this resource is from the ck-12 library	0
using the present in writing simple present and present progressive one point grammar lesson 2 1 11 each one point grammar lesson is a ready-to-go package that enables teacher to confidently present a discrete item of grammar to student and immediately check their comprehension with an accompanying activity worksheet lesson are designed to take between 10 30 minute but are flexible and can be combined with other activity a desired this zip file contains everything you need to teach a successful lesson a powerpoint pt presentation on the focus grammar point and a one-page printable worksheet with answer key for practice the powerpoint is ready-made for teacher to present the language in a classroom and contains chart explanation example and image to support understanding of the concept the worksheet is provided in two form a a fixed pdf that can be printed out and used a is and a an editable word document that can be personalized there are a total 351 one point grammar lesson across 3 level 95 lesson are at high beginner cefr a 2 138 at intermediate cefr b 1 and 118 at high intermediate cefr b 2 each lesson is sold separately or the entire collection is available in a single package one point grammar lesson content form a part of a comprehensive grammar course element of success grammar for language learning the course help student learn grammar and remember it it cover the grammar student find when reading academic text a well a the grammar they will need to communicate in english and to write effectively chart and activity all feature authentic corpus-based language based on the 2-billion-word oxford english corpus so that student learn grammar a it is really used	0
