text	subject_id
learning get personal teresa perles edmodocon 2015 for the first time edmodocon will feature a special spanish-language session to highlight teresa perels and her learning get personal differentiating to improve outcome individual presentation the following blog post is written entirely in her native tongue perels teresa ha taught english a a foreign language for 30 year passionate about education and ict she spends hour on line searching for new methodology and tool to enrich student learning and improve their teaching four year ago teresa began using edmodo to release their finding and create activity designed to help student acquire the skill needed to succeed in their field perels present the speech personalized learning scaffolding differentiation to improve individual progress to illustrate how it is addressed and serf the need of each student listen in on how to use technology differentiating your teaching effectively adapt to specific skill reinforce concept and content and provide resource and opportunity for academic practice that are a diverse a your student ¿cuál e el mensa principal we esp era we torso se eleven led discussion espero we bean cosmo loch recurses technologist estes ah para sukarno immunodeficient a difference loch mandamus we el foremost a maestro alumnus e inspirer a torso docent a utilizarloch	1
global math challenge mini workbook the global math challenge mini workbook give you five free fun logic puzzle to enjoy with your student the perfect warm up before math class and a great way for student to explore different thinking strategy beautifully illustrated logic puzzle complete with answer and step by step explanation pdf format print out or distribute digitally via edmodo question suitable for elementary to junior high level the question we are created by the japan prime math olympic committee who have been training young japanese athlete for over 20 year featuring fun fully illustrated question for young learner right across the globe if you enjoy these question you can find many more for student aged 5-15 with global math challenge from sony global education sign up quickly and easily with edmodo connect take place from september 13 27 after signing up for the contest you will also be able to access the full global math challenge workbook featuring 30 plus puzzle for student aged 5-15	0
scratch lesson 03 moving the sprite continuing on from our previous lesson we will introduce a new block of code this time it is all about movement learn how to make your sprite move by pressing the up down left or right arrow key this in turn will enable you to start making fun presentation and even game have fun scratch is a free educational programming language that wa developed by the lifelong kindergarten group at the massachusetts institute of technology mit scratch is designed to be fun educational and easy to learn it ha the tool for creating interactive story game art simulation and more scratch even ha it own paint editor and sound editor built-in you can find more information and the on line editor at	1
using google apps for education creating a simple quiz in google form we all love creating a quiz on edmodo but sometimes you want a little bit more control over what happens to the data collected after a quiz or maybe you just want to teach your student how to create their own quiz the impetus for this screen cast wa a student driven inquiry for how to best create an assessment on line after learning all about google apps for education he wondered if he could use this to create his very own quiz and share it on edmodo with his class thus i created this tutorial or screencast to share with both him and the other teacher at our school the tutorial look at how easy it is to create a simple quiz and share this with the world	1
production of magnesium oxide the production of magnesium oxide is a very important lab in general chemistry the reaction between magnesium and atmospheric oxygen offer some very distinct data that student can use to calculate the formula my student do this lab every year after our mole unit is complete the teacher note contain hint that i have developed over the year doing this lab i require my student do lab write ups this particular lab asks student to turn in a mini treefled the tree fold encourages student to work together for a finished product a well trust their partner to complete their part in addition student see other student work on the same lab -- in other word their presentation tri fold are graded based on the following modified rubric title and author 5 point introduction which includes the hypothesis 10 point abstract 20 point result 10 point discussion 15 point the analysis question conclusion 20 point and citation 5 point virginia standard of learning chemistry ch 1 the student will investigate and understand that experiment in which variable are measured analyzed and evaluated produce observation and verifiable data ch 2 the student will investigate and understand that the placement of element on the periodic table is a function of their atomic structure ch 3 the student will investigate and understand how conservation of energy and matter is expressed in chemical formula and balanced equation ch 4 the student will investigate and understand that chemical quantity are based on molar relationship	0
google drive tip and trick two of my favorite tip and trick 1 automatically converting word file into google doc 2 offline access for file using google apps for education can drastically change and improve your instruction and teaching not only doe it create a flipped environment whee your pupil are engaged at home and come to lesson fully prepared and ready with question it also enable collaboration on line and present you the teacher and your student with a suite of productivity app freely available at home you will not have to worry about cost for struggling family compatibility issue between different software and device or student forgetting to bring in their work everything is stored in the cloud and available for free however i do get a lot of question about working in the cloud the main question being can i access my file without the internet and how do i convert word into google doc this tutorial or screen cast will answer those two question in under five minute note for these function it is necessary to use google chrome browser	1
hackathons a pedagogy in the word of edutopia brandon zora student are coming out of school expected to solve 21st-century problem and enter into occupation that have not even been imagined yet schooling is not designed in this manner so we wanted to give student an opportunity to solve problem in authentic context using 21st-century skill and collaboration technique we wanted to break down wall between classroom and have student use interdisciplinary skill to solve problem with team of their peer with mentor and with industry professional hackathons usually take place over a set time frame such a a weekend where different people with different skill and ability work together to propose a solution to a problem the solution can be code based wearable technology analog or any type of product imaginable it is within blackthorn that student are utilizing their skill and knowledge to solve problem it is project-based learning inquiry-based learning and stem all wrapped up into one activity it is about design thinking and truly a 2 1st-century learning opportunity student are working collaboratively within mixed-ability group to examine problem and come up with solution check out this article for more	1
why most educator use edmodo video presentation about why most educator use edmodo	1
self-perceptions of non-arab non-native english speaking teacher the status of being native or non-native ha been extremely important in tesol job market because it is relevant to a large number of critical issue beginning from the recruitment performance and evaluation of teacher a well student perception and satisfaction aim of the present study is to focus on non-arab non-native teacher teaching english a a foreign language to arab student in the middle east these teacher neither share l 1 with their student nor do they speak english a their mother tongue the present pioneer study focus on the self-perceptions of these non-arab non-native efl teacher in order to verify if they perceive themselves different from other non-native teacher fraternity and if so how this perception influence their teaching practice the result of this study show that non-arab non-native speaking teacher hold a very positive self image of themselves and feel very confident about their command of english	1
google apps for education google doc advanced layout create a resume or cv this tutorial explores some of the more advanced layout option of google doc using the gafe google apps for education suite a a certified google educator i love trying new thing with google doc and one of those is creating an original look cv or resume if you are in need of an on line resume or are teaching your student how to create one this video might be just what you need it discus the different layout function within google doc you can utilize in order to create that personalized cv	1
german vocabulary family relationship crossword this family tree crossword on family and relationship die familie ind beziehungen is for teacher and student alike who are interested in teaching or learning german direction fill in the grid with the corresponding german word after solving the relationship based on the given family tree answer are included download and have fun	0
webquest london holiday this web quest is aimed for intermediate efl or esl student the student will assume the role that their parent will give them up to 600 pound for a three-day cultural holiday in london on some condition they will search the web to find the information they need to make choice that meet all the request and prepare a multimedia and an oral presentation on their choice they will answer a survey on the whole process note that in order for you to receive the answer to this survey you must create a copy of it in your google drive account and replace my link with yours	0
german vocabulary weather and season crossword this pictorial crossword on weather and season ad wetter ind die jahreszeiten is for teacher and student alike who are interested in teaching or learning spanish direction fill in the grid with the corresponding spanish word for the given picture clue answer are included download and have fun	0
simple present v present progressive present progressive one point grammar lesson 1 7 5 each one point grammar lesson is a ready-to-go package that enables teacher to confidently present a discrete item of grammar to student and immediately check their comprehension with an accompanying activity worksheet lesson are designed to take between 10 30 minute but are flexible and can be combined with other activity a desired this zip file contains everything you need to teach a successful lesson a powerpoint pt presentation on the focus grammar point and a one-page printable worksheet with answer key for practice the powerpoint is ready-made for teacher to present the language in a classroom and contains chart explanation example and image to support understanding of the concept the worksheet is provided in two form a a fixed pdf that can be printed out and used a is and a an editable word document that can be personalized there are a total 351 one point grammar lesson across 3 level 95 lesson are at high beginner cefr a 2 138 at intermediate cefr b 1 and 118 at high intermediate cefr b 2 each lesson is sold separately or the entire collection is available in a single package one point grammar lesson content form a part of a comprehensive grammar course element of success grammar for language learning the course help student learn grammar and remember it it cover the grammar student find when reading academic text a well a the grammar they will need to communicate in english and to write effectively chart and activity all feature authentic corpus-based language based on the 2-billion-word oxford english corpus so that student learn grammar a it is really used	0
using google apps for education google slide insert and edit an image this video is part of the series using google slide to better you fluency with technology in the classroom this tutorial look at some of the new image editing option available in google slide we learn how to insert crop resize adjust and recolor an image	1
nurture curiosity in your classroom teacher should stay curious and share that curiosity with student this video showcase teacher using strategy to tap into what interest them while at the same time maintaining neutrality to encourage all student to participate in class by asking question such a why do you think that enlisting the classroom and showing appreciation teacher model curiosity and engage all learner	1
history place great secondary source article on a variety of topic	0
innovate and flourish john shoemaker edmodocon 2015 john shoemaker is a technology specialist who facilitates project smart a long-term professional development technology initiative for secondary teacher in the school district of palm beach county shoemaker support over 12 000 teacher in integrating all form of technology including i pad and edmodo currently pursuing his doctorate at grand canyon university shoemaker is also an edmodo certified trainer an apple distinguished educator and serf on the advisory board for the i book author certification program shoemaker edmodocon session innovate flourish setting your school or district up for edtech success will present how one district successfully integrated edmodo across it school from strategic planning to hands-on training this session will give you idea and tip on how to meet demand support teacher and staff personalize learning take tech beyond the classroom and more what is the best piece of advice you have received from another educator i believe the best piece of advice i have ever received from an educator came during my student teaching in a small town just north of pittsburgh my supervising teacher anita alberti told me to go room to room with my camera and copy everything i could from my peer she wa not telling me to steal instead she wa showing me the importance of learning from our peer why recreate an entire project when the teacher down the hall ha a great project that you could just tweak to meet your need by harvesting idea from our fellow teacher we get more engaging lesson and project more importantly it save u time in the long run why reinvent the wheel when your neighbor ha a great wheel next door you can start from what have your student taught you over the year my student have taught me a lot one thing i learned from my student early on is something i include a the introduction to my philosophy of teaching my student showed me they are all learner my philosophy of teaching state i believe that all student posse an inherent need to acquire knowledge no matter where they come from their economic status or their level of cognitive development what is the one thing you hope people take away from your edmodocon presentation to find at least one thing they can take back to their school or district to help get more people using edmodo by providing a wide range of example from a district and school level i really hope to provide something for everyone to take away	1
google apps for education using google slide creating a pdf e-book this tutorial will show you how to save your slide document a a pdf e-book format you can then share your self published e-book to read on most e-readers	1
google apps for education google doc advanced layout creating a syllabus or scheme of work we all have a lot of document or file on line this video show how you can organist those file in a more productive manner it is a great way to create you on line syllabus or scheme of work and a with all this in the cloud your syllabus will be easy to update with the most recent information the screen cast tutorial is under ten minute and discus linking document layout and share setting	1
mobile phone under-utilized pedagogical device the potential of digital mobile device such a personal digital assistant and mobile phone to achieve a large scale impact on learning ha been well documented by a number of researcher recent investigation on mobile device have increasingly focused on the importance of documenting the relationship between pedagogy and technology we see many educator heaping malediction upon the prevalent use of mobile device and kvetch that the learner have become addicted to these device they are of the opinion that learner should not be allowed to use mobile phone in the classroom we have paid very little attention to the fact that a lot of learning ha been done on mobile phone and these ubiquitous device can be used a valuable teaching tool	1
homestead act of 1862 in the early 20th century american streamed to the middle of the country because of the homestead act these we are federal law that gave people ownership of the land for free in this public radio story you will hear from people who grew up on homestead in montana in the early 20th century describing life on the plain both people s family we are fairly isolated and self-sufficient working hard to make a living off the land but their affection for that lifestyle is still strong about this resource this resource feature a real world public radio story listening comprehension question and classroom discussion theme about listen current listen current make it easy to bring authentic voice and compelling non-fiction story to the classroom we curate the best of public radio to keep teaching connected to the real world and build student listening skill at the same time for more information and teaching idea	0
add appointment and event at google calendar google calendar make it easy to schedule meeting appointment class or event with specific start and end time a calendar entry is considered to be anything that you would add to your calendar be it a 2 day conference a 1 hour meeting or a 3 hour dinner you can schedule all of these thing on google calendar and even have entry overlap with each other in this lesson you will review the various way you can create a new calendar entry just follow these step 1 click and drag on your calendar screen 2 use the create event link 3 create from your calendar list 4 create from an sm message 5 use the quick add link	1
to tell part 1 suggestion for the construction of a narrative world in italian	0
google doc and drive sharing privacy printing and publishing book google doc and drive about how to sharing privacy printing and publishing	1
using google in the classroo gmail using label and filter filtering and labeling within gmail many of u use gmail a our school email and we can get overloaded by email email from parent administrator staff child resource website update from edmond etc within gmail there is a function called filtering and label when combined these make life so much easier if you are not yet using these two amazing feature of gmail it is time for you to learn about them they will save you time and make your mail experience a much smoother and more productive one the following is a screencast or tutorial of about 5 minute you can share with your staff or watch individual to learn how to do this	1
culture of caring randy fairfield edmodocon 2015 presentation by randy fairfield at edmodocon 2015 culture of caring building a support community with student randy fairfield teach language art and social study to a diverse student population and over the past seven year ha worked with migrant learning english student at-risk of dropping out and student being home schooled to further his practice fairfield master degree in teaching will soon be accompanied by a national board certification his passion for education is shared by his wife of 11 year who is an elementary teacher together they are raising three child and the largest dominique wilkins basketball card collection the world fairfield tell edmodocon attendee how to tap into student hope and dream during his culture of caring building a support community with student and parent session with tool to personalize learning and encourage parental involvement learn how edmodo give you the flexibility to communicate one-on-one tailor opportunity to an individual interest reduce dropout rate and position both student and teacher for success about randy fairfield what inspired you to apply to speak at edmodocon because edmodo helped me transform from an average teacher to an excellent teacher i wanted to spread the love had shared about edmodo at a few other conference and always received the same response from fellow educator why is not everyone doing this i applied to speak at edmodocon because i felt sharing the way i use edmodo might help other teacher what is the one thing you hope people take away from your edmodocon presentation i hope it is an ability to see how edmodo and technology in general can be used to deepen relationship there are few greater feeling than knowing that you helped to provide the spark that helped a student enjoy your content area for the first time or helped a student realize they could be successful or helped a student decide what they want to be when they grow up what have your student taught you that everyone ha a story and that there are reason that underlie everything we do with that in mind my student have helped me to see people a diverse individual with diverse need	1
parent or teacher conference form here is a basic form that wa created for all teacher in our district to help brainstorm idea on what to have prepared for parent or teacher conference	1
basketball blooper ela basketball team in basketball blooper student use their favorite basketball team to practice correctly capitalizing date and name a sport editor they edit sport report for their favorite team and their own school when they finish they can repeat the activity using a different team this performance task ha different edition for all 30 nba team	0
learn sql with fun game sql is a language to get data that is extremely useful in the real world it is frequently used in business small and large to understand how much money they are making on what product what their user are doing how likely their user are to come back what are their user email address so they can email them etc it is also very easy to learn and sort of a light version of programming it also give you access to understand data from government educational project you name it so student should learn it and what is more this website provides an easy and fun way to learn it with real-world example try it out the way i know it work is i have provided it to my colleague at two business and they have used it effectively and now can query sql on their own	1
negative time negative in grade five i asked my mathematics teacher why is negative time negative positive the repose i received wa unenlightening to say the least it just is this made me angry in this short video i explain once and for all why this peculiar fact is so [ actually that is not quite true i explain it twice the first is a way that is acceptable to most student and teacher alike and the second is a way that dig a little deeper into the mathematics behind the scene of the first approach one that satisfies the true mathematician within each of u ]	0
system analysis and design case study the sac study depicts a fictional company named maple ridge engineering mre that is based on real-life problem front the author kendall et al consulting experience one of the best hypertext-based case for training system analyst	1
ng equip teaching channel video developed through a collaboration between achieve and the teaching channel these video capture some of the key component of what the ng look like in instruction a well a the evaluation and feedback process the rubric is designed to support the video cover topic that are embedded within the rubric such a three-dimensional learning and monitoring student progress in addition to providing a snapshot of some of the topic and deep thinking around the ng that the equip rubric support the video also highlight some of the major question and idea that emerge from an equip for science training	1
teach critical thinking skill this video highlight the importance of encouraging evidence a information is widely available it is increasingly important to ask student how do you know that by acknowledging relevant personal experience citing and analyzing source of information teacher can demonstrate critical skill for learning and encourage these skill in student mapped to common core standard for math and ela	1
reduce stress in your classroom for deeper learning this video demonstrates how within the constraint of time and space teacher can fit more into each school period while at the same time create a le stressful le frenetic environment watch a teacher in real high school classroom create environment conducive to developing thinking and critical skill	1
