text	subject_id
the rhythm trainer a website that train listener to transcribe or identify basic rhythm pattern	0
scratch tutorial 05 create a retro maze game we have all seen maze game like this some challenging and fun others scary and perfect for halloween or an old classic the jump scare well i am going to show you how you can make your very own maze game using scratch if you use them for scare or not that is up to you in this video you will earn all the basic step to create a maze game in under ten minute	1
no passport required global classroom collaboration in action kathy pittinger edmodocon 2015 before becoming a teacher kathy pittinger earned a bachelor s degree from the university of wisconsin got a master s from the american graduate school of international management and spent 15 year working in international business in the caribbean a lifelong learner pittinger now focus on giving student the tool and strategy they need to explore the world in her 12 year a a gifted and talented elementary teacher pittinger ha continually strives to acquire and apply new skill to enhance student learning during her no passport required global classroom collaboration in action pittinger will show how she us language a an opportunity to give student a new way to express themselves pittinger discus how she translates their world view by pairing bilingual 4th and 5th grader with student in other country and to see project-based best practice that can help increase communication collaboration and cultural awareness in your classroom what s the one thing you hope people take away from your edmodocon presentation i hope they ll be motivated to take risk and try something new i hope they ll encourage their student to explore new world of possibility through collaboration with student from other country and culture i hope they ll discover how diverse amazing and exciting the world is right now and grow to appreciate how rewarding it can be to establish relationship with teacher and student from country other than their own	1
creative problem solving prompt for dog breath by dav pilkey creative problem solving process with dog breath a fun way to teach the process	0
curling provides quick effective workout curling is the olympic sport of propelling a rock across the ice field with a broom called a brush although it look simple curling ha been known a chess on ice and requires a lot of athletic ability to move the rock forward accurately listen to this story to learn what skill curler need about this resource this resource feature a real world public radio story listening comprehension question and classroom discussion theme about listen current listen current make it easy to bring authentic voice and compelling non-fiction story to the classroom we curate the best of public radio to keep teaching connected to the real world and build student listening skill at the same time for more information and teaching idea	0
edmodocon 2 015 session 1 opening keynote and edmodie award	1
chem classic song this is mark rosengarten web page that ha all his chemistry song or video and packet my ap chem love the song despite the tune these song are a fun way to introduce topic	0
blank keyboard worksheet a hand-drawn blank keyboard for student to fill in letter or to test their skill i like to give this 5 time a year on the first day of school i request no guess at the end of each quarter i request them to fill in all of them	0
overview of to infinitive gerund and to infinitive one point grammar lesson 3 11 5 each one point grammar lesson is a ready-to-go package that enables teacher to confidently present a discrete item of grammar to student and immediately check their comprehension with an accompanying activity worksheet lesson are designed to take between 10 30 minute but are flexible and can be combined with other activity a desired this zip file contains everything you need to teach a successful lesson a powerpoint pt presentation on the focus grammar point and a one-page printable worksheet with answer key for practice the powerpoint is ready-made for teacher to present the language in a classroom and contains chart explanation example and image to support understanding of the concept the worksheet is provided in two form a a fixed pdf that can be printed out and used a is and a an editable word document that can be personalized there are a total 351 one point grammar lesson across 3 level 95 lesson are at high beginner cefr a 2 138 at intermediate cefr b 1 and 118 at high intermediate cefr b 2 each lesson is sold separately or the entire collection is available in a single package one point grammar lesson content form a part of a comprehensive grammar course element of success grammar for language learning the course help student learn grammar and remember it it cover the grammar student find when reading academic text a well a the grammar they will need to communicate in english and to write effectively chart and activity all feature authentic corpus-based language based on the 2-billion-word oxford english corpus so that student learn grammar a it is really used	0
i am very real by kurt vonnegut when a north dakota school board burned copy of slaughterhouse five vonnegut responded with this letter arguing against censorship	0
wwi europe plunge into war power point and keynote presentation mr harm ha designed a number of powerpoint and keynote presentation to help student understand history designed by a teacher for teacher this powerpoint focus on europe plunge into war 1914-1916 this presentation is designed to give them an overview of the event in the first two year of the great war student will be shown map animation and description of some of the major event of the first world war the presentation is totally customizable allowing you to add your own picture graphic and animation to take what we have done even farther it come with presentation note to help you discus the subject and engage them in the event of world war 1 at le than $ 4 00 it will save you time and lay the foundation for presentation that help student understand and remember the topic include alliance system chain reaction the western front two front war schlieffen plan first battle of the marne stalemate trench warfare battle of verdun battle of the somme the eastern front number of slide 33 included in the presentation package 1 keynote presentation 2 power point presentation 3 text edit file of the outline of the presentation and presenter note the package is a digital download zip file of these three item source mcdougal littel world history pattern of interaction the world at war the great war chapter 29 section 2 europe plunge into war go here to learn more	0
material for poetry introduction for 6th grade i use these with my poetry introduction for 6th grade lesson i just did a google search for image with these type of poem	0
assessment and rubric assessment of student mastery of content take many form this page includes support material for assessment that work with the common core state standard and rubric for many different assessment product it also contains some information on the creation of rubric and assessment in general	0
sculpture critique aid feldman model of art criticism	0
using google slide tutorial 02 insert a background and video in this tutorial we learn how to insert an image or colour a background we also insert or embed a youtube video after inserting this video can be played from within the presentation without having to leave it great for when you want to present something in class	1
weekly lesson plan master a template for a weekly lesson plan feel free to edit and make any necessary change	0
kahoot magnetism and electricity kahoot is a fun game that you can play with your whole class to review content magnetism and electricity	0
plate tectonics map project expectation this one page printable or deliverable lay out the expectation for a plate tectonics google map project	0
the game crafter the game crafter tgc is the world s first web-to-print game publishing company and offer a print on demand game publishing service tgc empowers game designer around the world by allowing them to make a board game card game and custom playing card through a website using the latest web technology tgc developed an on line publishing platform that simplifies the design manufacturing and retail process related to tabletop game tgc is perfect for teacher working on game-design unit with their student who want to bring their creation to a physical product	0
inspiration quote from designer need a quote for a presentation or lecture check out these top 80 quote from designer	1
scratch lesson 04 creating a race gam our previous three lesson went over all the basic skill needed to create a game lesson 1 painting or designing a sprite lesson 2 changing the look or costume of the sprite lesson 3 moving the sprite and adding interactive element this tutorial or lesson 4 will walk you through the entire process needed in order to create your very first race game have fun all you need are the skill from our first three lesson and some creativity brainstorm first work with a partner or discus in class before designing you game set then follow all the step in this tutorial and you will be sharing your game with the world in no time	1
medieval project student research a topic from the middle age and then create a fax stained glass window to tell the story a window enabled the illiterate to read story during the medieval period material for the window include 11x 1 7 black construction paper sheet of vellum and watercolor pencil	0
conversation make your message matter i created this rubric to teach my student how to have meaningful constructive conversation with each other not only will it help you intentionally build a respectful class community and address the common core standard for speaking and listening but you will also reinforce those elusive 4cs of 21st century learning collaboration communication critical thinking and creativity routine and structure for holding meaningful respectful conversation are especially helpful for student with extra learning or behavioral need and ell student but they are also useful digital citizenship reminder and stretch the thinking of advanced learner too by asking them how they can add more to a discussion and giving them new way to respond to others idea the nice thing about this tool is that it can be used across subject area to provide cue for healthy debate and discussion and it can help student navigate the social challenge of collaborative learning project once you have established using the icon a a routine for holding conversation you can spend more time deepening and extending the discussion instead of dealing with hurt feeling and redirecting off-topic chatter this blog post offer a summary of the powerful way that meaningful conversation can create a culture of learning in a classroom and highlight some other tip and trick for developing confident conversationalist thank you jecca lawson the far reach teacher	0
google doc lesson adding a page border did you know you can add a colorful page border to google doc in this video i will show you a fun little work around to create colorful border and stunning design within google doc all you need is your own creativity some table and fill colour have fun	1
task card inb note and game for clothing demonstrative adjective in french this 5-hour le on demonstrative adjective and clothing includes clear and easy- to-follow note for interactive notebook a well a 24 task card and a game for practice how can i use it to teach new learner about demonstrative adjective to review demonstrative adjective with learner to teach new learner about clothing to review clothing with learner a a learning station or learning center who is it for french student at novice level and up student in grade 6-12 at the end of the lesson student will be able to identify and use demonstrative adjective according to gender and number identify and use clothing vocabulary includes 22 page of content detailed instruction and idea for use note for inb on demonstrative adjective and their use note for inb on clothing 24 task card to practice demonstrative and clothing with answer key dynamic game to practice demonstrative and clothing with game piece dice etc	0
edmodo for digital educator this is an info graphic of my edmodo implementation in the classroom an excellent guide in designing professional development training	1
spanish color lesson this 3-hour lesson on color us fun activity and game to work on student writing speaking and listening how can i use it -to teach new learner about colors-as a review for student who have seen the content before-as a learning station or learning center who is it for -novice level spanish students-students in grade 6-12 includes -8 page of content-detailed instruction and idea for use-colorful sideshow and scaffolded notes-writing activity using culturally relevant item such a flags-two communicative activity that get student talking instruction for dynamic and fun game to practice with colors-proficiency-based assessment with stamp sheet	0
google sheet lesson 6 advanced use of image you can do a lot more with your image than simply inserting them onto a spreadsheet this advanced tutorial walk you through the image function and how you can use it to link your image to a single cell you can now use image a you would other data resizing the cell adding a column or row and copying the cell	1
booknotes for othello about studymode studymode is the world largest learning community for student we we are founded in 1999 on the idea that learning is mean to be social we have built a platform for student to find to create and to share over 100m flashcard and 2m research document on common school subject studymode book note maybe you missed a class or maybe you just can not quite comprehend stream of consciousness style either way studymode com ha you covered when it come to free book note on the most widely read book in high school and college curriculum othello book note provide professionally written book summary including character plot summary analysis of major theme and a discussion of important theme and symbol you will also find quiz discussion question and suggested reading list to enhance your understanding of the material	0
ocean current presentation ocean current are divided up between student group student create a presentation about their ocean current and post it to edmond	0
activity based approach to mobile learning mobile learning mall learning theory classification of activity samr model q and a	1
winter snowman poop i give a bag of mini marshmallow to my student every year with this little love note attached i have used this with student in 6th and 8th grade and even those older kid some 15 year-old 8th grader love the note and the sweet treat	0
viola interactive learning file this file wa originally created in smartnotebook and is also available via smartexchange if you would like access to the smart notebook file connect and message me	0
reading fluency tracking used to track and maintain orf record	0
common core performance task expression this is a worksheet that allow student to write complete sentence a well a explain each task a they perform it this is a common core style created worksheet to help your student show mastery of solving linear expression and inequality grade 8-11 can complete these 4 task at different level	0
wh question with be going to future form one point grammar lesson 1 10 4 each one point grammar lesson is a ready-to-go package that enables teacher to confidently present a discrete item of grammar to student and immediately check their comprehension with an accompanying activity worksheet lesson are designed to take between 10 30 minute but are flexible and can be combined with other activity a desired this zip file contains everything you need to teach a successful lesson a powerpoint pt presentation on the focus grammar point and a one-page printable worksheet with answer key for practice the powerpoint is ready-made for teacher to present the language in a classroom and contains chart explanation example and image to support understanding of the concept the worksheet is provided in two form a a fixed pdf that can be printed out and used a is and a an editable word document that can be personalized there are a total 351 one point grammar lesson across 3 level 95 lesson are at high beginner cefr a 2 138 at intermediate cefr b 1 and 118 at high intermediate cefr b 2 each lesson is sold separately or the entire collection is available in a single package one point grammar lesson content form a part of a comprehensive grammar course element of success grammar for language learning the course help student learn grammar and remember it it cover the grammar student find when reading academic text a well a the grammar they will need to communicate in english and to write effectively chart and activity all feature authentic corpus-based language based on the 2-billion-word oxford english corpus so that student learn grammar a it is really used	0
welcome to edmodocon 2015 and opening keynote and edmodie award edmodo ceo vibhu mittal reveals in his edmodocon keynote new product feature that make it easier to express yourself communicate how you feel in an instant like a post to give it a thumb up or enter your favorite facial expression to create an emotive pin a post want to make sure everyone get the message pinning let u you place your most important message at the top of a group s stream for all member to see find resource collaborate on edmodo spotlight where you can publish discover and collect content that have been tried and tested by educator just like you connect with parent with a brand new experience on the web and app for o and android it s easier than ever for family to get involved and support a child s learning	1
booknotes for brave new world about studymode studymode is the world largest learning community for student we we are founded in 1999 on the idea that learning is mean to be social we have built a platform for student to find to create and to share over 100m flashcard and 2m research document on common school subject studymode book note maybe you missed a class or maybe you just can not quite comprehend stream of consciousness style either way studymode com ha you covered when it come to free book note on the most widely read book in high school and college curriculum brave new world book note provide professionally written book summary including character plot summary analysis of major theme and a discussion of important theme and symbol you will also find quiz discussion question and suggested reading list to enhance your understanding of the material	0
a level marine science review ptt this is a review for the entire year of the cambridge a level marine science in one review ppt	0
math game math game allows student to practice math skill in over 1200 different way with more than 1 5 million question it also provides detailed progress report and student or classroom management tool that allow educator to focus on what matter most teaching	0
explain 3d car interactive 3d encyclopedia explain 3d how car work is interactive 3d encyclopedia focused on car that will help explain how main car system work encyclopedia includes engine clutch differential steering and suspension brake and more car system	1
real world rsvp edmodocon 2015 after starting her career a an event and wedding coordinator laura murphy soon realized that she d much rather be planning lesson and molding inquisitive mind following her passion murphy obtained a master s degree in education from the college of charleston and now work to instill a lifelong love of learning in her student when she s not teaching murphy love to explore the area surrounding historic charleston visit her hometown of lexington dine with friend and family and discover new classroom idea on pinterest currently an english teacher at charles pinckney elementary in mount pleasant murphy session real world rsvp inviting guest speaker to inspire student will demonstrate how she rewrote the book on student engagement by welcoming published author into her classroom listen in to how she used their professional insight to help student better understand the writing process introduce various genre and style create an authentic learning experience and more what inspired you to apply to speak at edmodocon i wanted a platform to share my idea with other teacher all over the world in hope it would inspire them to implement something similar in their own classroom i did t want it to be one of those idea i had that no one ever really knew about outside my inner circle and did t have the chance to try out for themselves what s the one thing you hope people take away from your edmodocon presentation i hope teacher realize that you don t have to do everything by the book or just because it is a standard you must cover to prepare for standardized testing think outside the box a little on how you can make learning fun and engaging for your student i hope that they ll give this a shot and see how it can change the culture in your classroom and reignite the love of learning in their student	1
percy jackson lightning thief part 2 study guide chapter 1-11 this is an awesome 18 page pdf of my original question and activity for the first eleven chapter of percy jackson lightning thief your student will learn a lot about the novel and mythology i am very proud of this study guide a always it contains some of my original artwork too common core text level question also look for my recently uploaded second set of question for chapter 12-22	0
the way we teach the way they learn the journey of learning ha gone through all the period from classroom teaching to e-learning and m-learning the evolution of mobile device ha changed the way of learning and teaching learner have become tech-savvy and are keen to be practical in using latest technology anywhere and everywhere this is the society of digital native who respect knowledge wisdom and human experience le and le and rely on the technology around them the most in this age student are inventing the way to use these device to learn what they want to learn and how they want to learn	1
personal mission statement contains the writing prompt and rubric	0
the goo-near-do flip presentation iste 2015 this presentation wa delivered a a 3-hour workshop this session wa developed to help teacher who use google apps nearpod and edmodo and are looking to flip your classroom this session received rave review from participant and lot of love on twitter so i am sharing it here	1
tradition plus technology equal the perfect equation to flip your classroom john choins edmodocon 2015 during his 16-year teaching career john choins ha worked in both public and private school in the waco texas area for the last 11 year he s taught middle school math including algebra to regular and per-ap math student and wa chosen a the 2014-15 teacher of the year on his current campus a strong advocate for using technology to transform the teaching and learning process choins flipped his classroom in 2014 and based on the positive effect vow to never go back to the traditional way of teaching again wonder how a flipped approach can benefit your classroom choins share how he us edmodo to engage student with video practice exercise and photo-based assignment submission with step-by-step instruction you ll see how integrating technology creatively and efficiently add up what inspired you to apply to speak at edmodocon this past year i used edmodo almost every day with my student a a part of flipping my classroom i had never flipped my classroom before and i wa absolutely amazed at what a positive experience it wa for me my student and their parent i want to share my success and my love for edmodo with anyone who will listen when i saw the request for video submission and the opportunity to persent at edmodocon i jumped at the chance to share what i do on a platform that i love what s the one thing you hope people take away from your edmodocon persentation that flipping their classroom is possible it can be done with ease and it can make a huge difference in the education of their student	1
comparing digital v traditional writing digital writing is writing that utilizes text hyper link graphic and video to remix and create a new kind of essay in this activity student will examine a piece of digital writing and compare and contrast it with a traditional news article both article are linked in the pdf this is a great introductory lesson to digital writing it engages student in reading and analyzing the design layout and writing of two different text to further their understanding of digital writing element and to prepare them to craft their own digital writing the pdf also come with a link to the digital google doc version of the handout so you can make a copy and student can complete the comparison digitally you can also edit the digital version to use different text	0
science partner list use this page to list partner for your class and easily refer to it all year long	0
veteran day interview veteran day is held on the anniversary of the end of world war i november 11 to honor u veteran and victim of all war student will have the opportunity to get first hand knowledge of a veteran experience by talking to a neighbor grandparent friend student will use this form to create question to interview a veteran rubric enclosed	0
