text	subject_id
project based learning project search what is it the project you will find here have been curated by bie and we are gathered from on line project library these project are meant to inspire your own idea or may be adapted to fit the need of your classroom information about bie at the buck institute for education bie our highest priority is to help teacher prepare student for successful life we do this by showing teacher how to use project based learning in all grade level and subject area a a mission-driven nonprofit organization bie creates gather and share high-quality pbl instructional practice and product and provides highly effective service to teacher school and district for teacher bie offer professional development on how to design ass and manage project that engage and motivate student for school bie help bring coherence to pbl practice across grade level and subject area and support the creation of school-wide process and structure to support pbl for district bie offer unrivaled service and expertise in creating and sustaining district-wide pbl initiative the exponential increase in demand for it service and product speak to bie s ability to help educator around the world provide a better education for all student	1
lab safety scenario i place my student in station and have them rotate through each scenario they identify 2 thing that are wrong and 2 way to correct each situation in order to be safe in the science classroom	0
quantifier for plural count noun and noncount noun noun article and quantifier one point grammar lesson 1 5 8 each one point grammar lesson is a ready-to-go package that enables teacher to confidently present a discrete item of grammar to student and immediately check their comprehension with an accompanying activity worksheet lesson are designed to take between 10 30 minute but are flexible and can be combined with other activity a desired this zip file contains everything you need to teach a successful lesson a powerpoint pt presentation on the focus grammar point and a one-page printable worksheet with answer key for practice the powerpoint is ready-made for teacher to present the language in a classroom and contains chart explanation example and image to support understanding of the concept the worksheet is provided in two form a a fixed pdf that can be printed out and used a is and a an editable word document that can be personalized there are a total 351 one point grammar lesson across 3 level 95 lesson are at high beginner cefr a 2 138 at intermediate cefr b 1 and 118 at high intermediate cefr b 2 each lesson is sold separately or the entire collection is available in a single package one point grammar lesson content form a part of a comprehensive grammar course element of success grammar for language learning the course help student learn grammar and remember it it cover the grammar student find when reading academic text a well a the grammar they will need to communicate in english and to write effectively chart and activity all feature authentic corpus-based language based on the 2-billion-word oxford english corpus so that student learn grammar a it is really used	0
science or social study video i would upload a science or social study video from discovery education for my student to watch at their leisure however when they we are finished they needed to respond to me in edmodo with 2-3 sentence complete about something they saw or heard or learned complete sentence writing wa our district goal for school improvement this incorporated my science or social study with meeting our sip goal	0
literature circle resource this is a great resource when doing literature circle it clearly defines the role each member must perform	0
child literature with a mathematics focus curated and thorough list of child literature with a mathematics focus a brief list of child book with a mathematics focus i have found useful a a center piece of classroom mathematics experience this list is nowhere near exhaustive nor is meant to be it ha been collated over time and added to regularly	1
abc puppet make a paper bag puppet for each letter of the alphabet a for alligator b for bat c for cat all the way to z for zebra 26 animal puppet in all great for oral language art activity play story time alphabet song and more includes stationery that fit on the back of each puppet for creative writing each page is available a a black and white student reproducible a well a a full color teacher sample	0
scratch lesson 01 - painting a sprite scratch is a free educational programming language that wa developed by the lifelong kindergarten group at the massachusetts institute of technology mit scratch is designed to be fun educational and easy to learn it ha the tool for creating interactive story game art simulation and more scratch even ha it own paint editor and sound editor built-in you can find more information and the on line editor at in this first tutorial or screencast we look at how to create our very own sprite our first sprite is created from scratch and ha 4 costume different look for more lesson or screen cast on the use of scratch have a look at upcoming screencasts feel free to share this video with your class a it is a great basic instruction to flip your teaching an introduce text-based programming or coding	1
personalized learning and student choice slide show with linked resource this is a google slide presentation given for professional development regarding the philosophy theory and practical application of creating a culture of student choice and personalized learning it is a 7-slide presentation that includes question for teacher reflection helpful tip and resourceful link to website including video info graphic and bulletin board site for teacher brainstorming this would be an ideal presentation to share with teacher for back to school or anytime throughout the year	1
response to literature essay writing bundle with this response to literature essay writing bundle be confident teaching response to literature essay writing and share the confidence with your student so they excel at their writing too i have personally had so much success using these tool in my own classroom for the last 15 year here is what is included in this 4-document 13 page total bundle 1 student gear up for response to literature writing by completing this supporting evidence character trait worksheet after reading a novel or story student write about 1-3 character including trait supporting evidence citation with page number from text and explanation of how each citation support each trait 2 response to literature essay writing is made simple step-by-step direction with writing prompt including a 5-page one page per paragraph response to literature essay writing packet a great scaffold for struggling writer each page directs and explains to student what to include in each of the 5 paragraph introduction body paragraph 1-3 and conclusion this is especially helpful in using the first time student writing a response to literature or poetry essay 3 the one-page response to literature essay outline is for student to brainstorm and organize their idea for an essay on the theme of a novel short story or poem also includes a student completed example with their final response to lit essay the outline includes section for title author theme introduction attention-grabber thesis statement summary body example citation or quote commentary and conclusion restate thesis sum up example insightful ending student will feel confident in their response to literature essay writing when using this outline and it will ensure that they include all of the necessary component in their final essay 4 student edit and revise their own or a peer essay using the revision worksheet for response to literature student may use gel pen to make editing rating and revising exciting enjoy and happy writing	0
energy resource and conservation learn all about energy in your world with these activity energy flow science museum of london choose the correct sequence of item to power object save the world wonderville listen to the brief introduction about how these machine generate energy and click continue when finished choose any of the country and read what percentage of energy is available by reading the top of the screen drag the most useful item into the correct location on the map to create enough energy to power the battery complete each activity in every country who s got what science museum of london look at the world map and select an energy type using the map key find a place in the world where there is a lot of that energy available and where there is very little of that energy available examine all eight energy resource type listed to see where energy reserve are located around the world	0
diversecity empowering student with repeatable professional role model diversecity is an on line platform featuring empowering role model from diverse background almost 1 or 3 of student across the united state reach college without ever encountering a strong professional role model particularly student from historically underrepresented background this resource aim to break through that representation bias providing an easily accessible platform for student to hear from strong repeatable role model tag reflection	1
showing possession pronoun and determiner one point grammar lesson 2 4 7 each one point grammar lesson is a ready-to-go package that enables teacher to confidently present a discrete item of grammar to student and immediately check their comprehension with an accompanying activity worksheet lesson are designed to take between 10 30 minute but are flexible and can be combined with other activity a desired this zip file contains everything you need to teach a successful lesson a powerpoint pt presentation on the focus grammar point and a one-page printable worksheet with answer key for practice the powerpoint is ready-made for teacher to present the language in a classroom and contains chart explanation example and image to support understanding of the concept the worksheet is provided in two form a a fixed pdf that can be printed out and used a is and a an editable word document that can be personalized there are a total 351 one point grammar lesson across 3 level 95 lesson are at high beginner cefr a 2 138 at intermediate cefr b 1 and 118 at high intermediate cefr b 2 each lesson is sold separately or the entire collection is available in a single package one point grammar lesson content form a part of a comprehensive grammar course element of success grammar for language learning the course help student learn grammar and remember it it cover the grammar student find when reading academic text a well a the grammar they will need to communicate in english and to write effectively chart and activity all feature authentic corpus-based language based on the 2-billion-word oxford english corpus so that student learn grammar a it is really used	0
equation goal of solving equation anchor chart for modeling and solving 1 variable equation can be enlarged for classroom display or reduced for inclusion in interactive notebook	0
need for pln in the 21st century with the rapid growth of social networking site influencing education policy maker and educator face numerous challenge in order to meet the growing demand and expectation of the learner our learner are born and brought up with technology and they expect the same life style in their education system a educator we must recognize the potential for ameliorating student engagement inside and outside the classroom using these technology facebook ha been used a a tool in education throughout the world with many of it advantage in the daily life of our student there are many risk involved in it edmodo on the other hand is purely a personal learning network pln developed by educator with education in mind it ha a similar interface to facebook and is free of charge it is easy to create the account or a classroom and ha simple functionality it is very safe since an educator can limit who may join the group i e student are invited explicitly	1
sequence information text this resource contains everything you need to get going with a lesson on sequential information text in your classroom learning objective recall information text type describe the feature of sequential text type explore the structure of sequential text type write a sequential information text on a given or chosen topic this resource includes detailed lesson plan sequential text structure sample text prompt template assessment rubric list of active verb list of adjective and adverb list of connective learning outcome of this lesson all student will write using the feature in an appropriate manner with intro and conclusion most of the student will write using the feature in a sequential order and structure with inviting intro and conclusion some student will write using the feature in an effectively organized logical and creative manner with engaging intro and conclusion	0
symbiosis quest power point this power point ha 20 symbiotic scenario the student are to read each slide and analyze the picture in order to choose which symbiotic level is depicted the four symbiotic relationship presented are symbiosis commercialism predation parasitism and mutual ism i upload the power point to the class website and have my student work with a partner on a laptop it is a lot of fun to hear them talk about each situation using educational dialogue this is also a good activity for flipped classroom if you do not have a set of classroom laptop or ipad you can also print the power point slide and place a small grouping around the room and turn it into a center activity great activity to follow symbiosis commensalism mutualism parasitism power pointgreat for any state texas biology teks 12 science concept the student know that interdependence and interaction occur within an environmental system the student is expected to a interpret relationship including predation parasitism commercialism mutual ism and competition among organism next generation science standardsms-ls 2 -1 analyze and interpret data to provide evidence for the effect of resource availability on organism and population of organism in an ecosystem ms-ls 2 -2 construct an explanation that predicts pattern of interaction among organism across multiple ecosystem [ clarification statement emphasis is on predicting consistent pattern of interaction in different ecosystem in term of the relationship among and between organism and biotic component of ecosystem example of type of interaction could include competitive predatory and mutually beneficial ]	0
google sheet in the classroom in this book allows teacher and student use google sheet to easily aggregate organize and analyze information in one place with advanced tool for sorting formatting creating and visualizing information with chart pivot table and entering formula shared on line spreadsheet can be used in a variety of setting some example of how teacher can use on line spreadsheet ● create a seating chart● record grade with an organized grade book● track attendance missing assignment behavior reports● store a database of contact information for student and parents● use a word cloud gadget to visualize written responses● use an apps script to automatically email feedback to student some example of how student can use on line spreadsheet ● collect data from across the web for research● create interactive flashcard with a spreadsheet gadget● format a weekly class schedule	1
q and a google drive share setting within a domain or department our first q and a you ask the question i will try and answer that question for you one of our viewer asked about the various share setting available within google apps and in specific those to share file within a domain or department we look at the different option available and i will give you a brief explanation a to what they mean	1
college admission process difference of college and degree in this course you will learn all type of degree and difference between university and college to help you make your decision it is based on the national association for college admission counseling nacac best practice and is continually updated to help increase your chance of getting to yes	0
small screen salary in small screen salary student use entertainment wage and schedule to practice making a table of equivalent ratio finding missing value in table plotting pair on a coordinate plane writing and solving equation in the form px equal q and substituting value into formula a entertainment lawyer they must advise their client to sign a contract a part of a negotiation with the cw network this performance task ha different edition for 6 career on the small screen including performer stuntperson and off-camera voice	0
using google apps how to use google keep google keep is a great way to track track of all your list idea or note this tutorial walk you through the basic of using google keep a teacher we all use post it and we can now have access to our post it note across all our device	1
7 way to use edmodo in the classroom in my info graphic i provide 7 additional way to use edmodo in the classroom the info graphic includes additional platform that can be incorporated into your lesson to enhance learning opportunity from exit ticket to reading challenge to webquests each graphic link to resource and material prepared for immediate implementation there are also link to additional resource and template from the google template gallery	1
improving the learning environment at a university in saudi arabia the teaching of english language in saudi arabia remains a challenge in spite of good language planning curriculum design appropriate textbook and infrastructural facility a well a efficient and qualified teacher this paper identifies possible factor that impede or motivate learning of the english language at the university preparatory year program a survey wa conducted with student and instructor of preparatory year program at king abdulaziz university in saudi arabia during the 2013 or 2014 academic year the result of the survey show some of the common problem faced by student that include attitudinal issue amongst student difficulty in switching from l 2 to l 1 and inefficient english language teaching and learning program in school this paper also discus the result of a blended learning experiment involving proposed innovative enhancement based on survey result including the incorporation of ed-gaming and role play simulation the experiment yielded a positive outcome	1
theme worksheet matching theme to story or book and sample answer key on this one-page worksheet sample answer key provided student match 12 theme given in first column to a character s in a story novel or movie then in the final column student explain in a complete sentence how that character show that theme example theme on this worksheet are one person can make a big difference a brave person can accomplish the unexpected and working together lead to success	0
the world of water intro video elesapiens is a collection of digital educational resource in science and the humanity in line with the curriculum for child between 7 and 13 it content combine cartoon and entertainment with quality teaching learning is encouraged through video game experiment and project pbl want more curricular focus of this resource water introductory video to the unit that present it main concept through an animated character glub the water molecule this resource invite the student to investigate everything related to this subject matter and think about it a individual and a a group by encouraging discussion in class ng alignment es 2 -2 describe and graph the amount and percentage of water and fresh water in various reservoir to provide evidence about the distribution of water on earth	0
different form of government here is a great web link to share with student when studying different form of government my student then did a research project on a form of government of their choice here is the link to the rubric i used to evaluate their prezi presentation	0
organelle cell skit student evaluation fun original creative and educational this is an adorable and creative high originality skit lesson on organelles-cells which is very easily modified and adaptable it is aligned to ng and very well-organized and ready to use this activity is good for limited technology and all inclusive saving time for that busy teacher this evaluation sheet may be used by the student audience to evaluate their classmate during the cell skit in three 3 group student are required to identify the cell part being acted out and give evidence of why they believe that to be the cell part that is being demonstrated cell wall cell membrane cytoplasm nucleus vacuole chloroplast and hypochondria this keep the audience engaged in learning a the skit are being presented and reach those learner who learn best through reflection and writing suggested ng application ms-ls 1 -2 from molecule to organism structure and process and cell membrane assessment of the function of the other organelle is limited to their relationship to the whole cell assessment doe and cell membrane assessment of the function of the other organelle is limited to their relationship to the whole cell assessment doe m structure function and information processing and cell membrane assessment of the function of the other organelle is limited to their relationship to the whole cell assessment doe and cell membrane assessment of the function of the other organelle is limited to their relationship to the whole cell assessment doe ms-ls 1 from molecule to organism structure and process and cell membrane assessment of the function of the other organelle is limited to their relationship to the whole cell assessment doe and cell membrane assessment of the function of the other organelle is limited to their relationship to the whole cell assessment doe	0
digital citizenship interactive poster do you need a simple but effective way to share the importance of digital citizenship with your student or staff this thinglink interactive poster provides a well rounded set of resource to help start and continue the important conversation this resource wa created by a common sense education certified educator my friend and colleague sheila monger tag thing link interactive digit digit lesson plan digital safety	1
anderson social on youtube every year the story is the same no matter where or what country your school is located many school district are facing budget cut a the government struggle to balance the budget in a time of global economic insecurity so the question that need to be asked is doe it make sense to continue spending a lot of money on dvd or should we begin the transition towards streaming one solution to this problem is to set-up a youtube channel and create play list for student to access this resource contains the link to my youtube channel i created this channel to be used a a source of inspiration class discussion activity enrichment etc my youtube channel includes play list for various theme that relate to social study and career planning example of student-made project educational documentary educational play list done by other famous youtube educational channel and much more	1
mesopotamia by the british museum the site is divided into ten chapter which address theme or topic relevant to the civilization of mesopotamia sumerian babylonian and assyrian the ten chapter are presented on a menu page where the user can choose a chapter by clicking on the word or icon relating to that chapter for each chapter there is a doormat page which is an atmospheric introductory page to the chapter the doormat page will automatically switch to the home page after a few second however clicking on the picture will switch it immediately the home page is an introductory page for the chapter within each chapter there are three section story explore and challenge the story is a presentation of information in a narrative form since the visual material surviving from mesopotamia is limited several of the story use specially-commissioned imaginative illustration the explore is a non-linear presentation of information the pupil control the order in which they access the information it is then the responsibility of the pupil and or or the teacher to make larger connection among idea and information and place the information in a context or framework the challenge is an activity that allows pupil to practice certain skill historical analytical mathematical observational within the context of a theme or topic relevant to mesopotamia	0
cell size and scale this flash-based presentation provided by the genetic science learning center show the relative size of very small object providing great reference for student to build background knowledge of size referencing item include coffee bean grain of salt and rice antibody water molecule carbon atom and more student can zoom through a proportional relationship of these item for a better sense of scale included in this resource is a detailed mathematical list of size comparison a well a a text summary discussion of size comparison shown this is a great reference for any secondary science teacher	0
project managing for google apps a one of the google educator group geg west bangkok leader i love sharing about google for education tool and apps that have improved or sped up my work flow one of those is kanbanchi project manager collaborate and manage your project in real time with the power of google apps great for planning or cross campus or sister school joint topic planning this is my video review of a web app we at geg west bangkok have been using for some time now	1
