text	subject_id
interactive google form guide learn how to create your own google form with this interactive google form guide are you a teacher in a gafe google apps for education school would you like to teach student how to create their own google form for multiple purpose this resource will provide you with the link to my google form thinglink channel containing interactive guide in a sideshow format step-by-step guidance to become more familiar with the google form interface and feature instruction for adding theme question type sample question and help text instruction for editing question adding custom navigation based on user response adding image video and more additional information regarding add-on tool to increase productivity and form management aligned to meet iste standard teacher and student creativity and innovation research and information fluency communication and collaboration critical thinking problem-solving and decision-making facilitation and inspiration of student learning and creativity design and develop digital-age learning experience and assessment model digital-age work and learning engage in professional growth and leadership for more technology guide and additional technology resource check out my other resource on spotlight tag google form	1
solving for pi this is a sheet to accompany a hands-on activity perfect for middle school math student use indirect measurement string and a ruler to find the circumference and diameter of circular object and then calculate an approximation of pi	0
ap bio dna or rna flip quiz online jeopardy style game that cover dna or rna transcription translation and mutation for ap bio or higher level honor biology	0
water polar molecule of life water-power-point-1520355 teaching resource teacherspayteachers com water-power-point-1520355 teaching resource teacherspayteachers com le than mg arc equal and c 2 equal 18349401 and cv equal 2 0 and ch equal 1 or greater than water is the most important liquid on earth it is a very important compound in many science discipline this power point cover the property of water which make it so important for life polar covalent hydrogen bonding hydrophobic hydrophilic cohesion surface tension adhesion high specific heat high freezing point chemical buffer vaporization density normality can be used for all state i am in texas and this power point aligns with biology and chemistry tek 4c and 10a	0
compound adjective and word order explore the word order of adjective explore the usage of compound adjective demonstrate the usage of word order of adjective and compound adjective	0
what is 21st century education video an inspirational video titled what is 21st century education by ef explore america that explains why teacher really need to use technology to engage their learner this video is aligned to address iste standard our world is changing at an unprecedented pace to prepare our student lesson must go beyond the 3 r and foster 21st century skill skill like critical thinking communication collaboration and creativity will be essential for student to take on the challenge and opportunity that lie ahead source youtube- what is 21st century education by ef explore america link	1
fan letter fixer ela in fan letter fixer student use their favorite television show to practice using comma in the greeting and closing section of letter they use this knowledge to create their own fan letter to a character on the show when they finish they can repeat the activity using a different television show this essential ha edition for 16 different tv show including adventure time looney tune and max and shred	0
multiplying binomial mentally practice multiplying binomial mentally practice this resource is from the ck-12 library	0
periscope explore the world through someone else eye explore the world from someone else perspective while there are many way to discover event and place periscope provides a way for user to experience a place right now through live video a picture may be worth a thousand word but live video can take you someplace and show you around periscope user can connect live through broadcast leaving chat message and floating heart for like video sharing can be public or shared with specific user account are created through twitter account and broadcast can be shared live on twitter while this tool should be used with caution with student especially with student privacy right it is a powerful professional development tool for educator to learn from one another and share video from around the world	1
intermediate math centre this set of generic math centre incorporates a variety of learning activity that can be customized to fit any math unit it is most suited for grade 5 10 to see an example of it in action with grade 7 and 8 check out this fraction unit do you want your student to be able to say all this i take responsibility for my own learning and for helping others learn i manage my time and activity productively learning self -management is part of the curriculum my teacher will help me i understand that keeping material orderly help everyone learn if so then consider delving into the world of math center this package includes a self and teacher assessment checklist for three of ontario learning skill a well customize the checklist customize the center make this resource your own and feel free to share widely a long a you tell the good peep where you got it from and for goodness sake give it away freely do not charge money for it	1
ferpa guidance for school official excellent tool to help school admits understand ferpa and how to ensure compliance	0
factoring using difference of square this is the second in a series of factoring presentation that cover different way to solve quadratic equation including using the greatest common factor difference of square the trinomial rule and slide and divide a way of solving quadratic when a is not equal to 1 there is also an accompanying graphic organizer available that fold with four flap a solution slide is included a the last slide which is easily removed if you want to push the presentation to your student or use the slide that contain practice problem a a quiz or homework included in the note on the slide are detail about slide animation	0
got cent money game have fun teaching your student about money play a game where student can compete with each other to see who win this game only deal with change this game ha picture of coin that the student need to add up and select the right answer the game will let them know if they got their answer right or wrong this is a great fun activity i have another game posted that ha both change and bill you can check out called money trivia game	0
google doc in the classroom a book about the real time collaboration of doc in google drive make it ideal for group assignment revision cycle and shared note built in tool like auto save and revision history comment and an equation editor are useful for student and teacher alike	1
discovering math computation student objective add subtract multiply and divide rational number create a game incorporating computation on rational number find the square and the cube of number use algebraic property and apply a variety of computational method and algorithm to evaluate expression utilize the order of operation to correctly evaluate expression work with a team to write and evaluate expression calculate the rate of change caused by earned interest on investment use estimation to plan and budget for a trip to chosen location	0
flipped classroom planning template this basic template is a quick form for preparing and directing flipped classroom lesson template address objective and learning target delivery platform assessment method tutorial resource student requirement and procedure for student accountability for more information on flipped learning	1
part of an expression this play list focus on parsing complicated expression and how individual component such a term factor variable coefficient and constant make up an expression it is designed to be ready-to-use for student with original content and link to open educational resource oers to enhance student understanding of the material the play list can be used a a stand-alone resource for student review or it may be used a a teaching tool within a lesson plan if it is used a a teaching aid it is suggested that the explore section and the video and practice exercise that follow be integrated into the lesson practice and challenge exercise are included at the end to gauge student comprehension of the material a ref equal link to corresponding teacher edition	0
graph using slope-intercept form a sample application this video demonstrates a sample use of graph using slope-intercept form this is a resource from the ck-12 library	0
presentation in the classroom with google slide developing your slide presentation on line in google drive make it easy to share and work concurrently on slide with others with the ability to add drawing image and video you can use presentation for a variety of project some example of how teacher can use on line presentation ● showcase student work on a class website with embedded presentations● create template that outline specific topic for student presentations● publish how to presentation with screen shot and videos● design certificate to print or to send virtually some example of how student can use on line presentation ● create a sideshow with picture for a class project● collaborate easily for group presentations● storyboard video comic strip written assignment	1
project based learning pbl explained what is it this simple video make the essential element of pbl come alive and brings to light the 21st century competency collaboration communication critical thinking that will enable k-12 student to be college and work-ready a well a effective member of their community why do we like it the video help introduce project based learning to educator parent and community member who are new to pbl by giving them a simple starting point for further discussion how can you use it use the video a an entry event to start a discussion with peer staff parent and community member about what is pbl	1
introduction to audacity an easy to understand handout for the introduction to the audio editing free software named audacity	1
the look of power how woman have dressed for success text and question after wwii a large number of woman entered the workforce in corporate america and began to hold job historically held by men in this article karen grigsby bates from npr morning edition discus the evolving relationship between power and fashion a it relates to the history of woman in the workplace	0
back to the future le than strong greater than mathematical domain le than or strong greater than le than span data-sheets-value equal [ null 2 and quot rratios and proportional relrationships measurement and data statistic and probability the number system and quot ] data-sheets-user format equal [ null null 513 [ null 0 ] null null null null null null null null 0 ] greater than rratios and proportional relrationships measurement and data statistic and probability the number system le than or span greater than le than strong greater than topic le than or strong greater than r le than span data-sheets-value equal [ null 2 and quot rratio proportion rate speed linear constant input output variable problem solving mental math fraction percent measurement unit conversion and quot ] data-sheets-user format equal [ null null 641 [ null 0 ] null null null null null null 0 null 0 ] greater than ratio proportion rate speed linear constant input output variable problem solving mental math fraction percent measurement unit conversion le than or span greater than le than strong greater than grade level s le than or strong greater than 6 7 8 le than strong greater than durration le than or strong greater than 1 2 hour le than strong greater than resource le than or strong greater than lesson plan individual powerpoint presentrations pdf activity	0
cold warrior simulation student will work together a a team to gather the most point while simultaneously protecting their nation against a nuclear strike by the other team ideal for u history or international relation class	0
disruptive innovation michael horn-edmodocon keynote 2015 co-founder and executive director of education at the clayton christensen institute horn lead a team that educates policymakers and community leader on the power of disruptive innovation in the k-12 and higher education sphere through it research their aim is to transform monolithic factory-model education system into student-centered design that educate every student successfully and enable each to realize his or her fullest potential horn is a published author and ha written several white paper about blended learning he ha also written article for numerous publication including forbes the washington post the economist the huffington post and education week tech and learning magazine named him to it list of the 100 most important people in the creation and advancement of the use of technology in education michael wa also selected a a 2014 eisenhower fellow to study innovation in education in vietnam and korea keynote focus online learning in school is changing how student learn in the closing keynote michael horn will discus how educator can design learning environment around this disruptive innovation to harness it benefit personalization access and equity at scale to unleash student achievement	1
the tourist dilemma ela in the tourist dilemma student use their favorite you s city to practice narrative reading and writing in a real world context a travel writer they have to write a personal narrative about a visit to a tourist site in the city they read and annotate personal narrative and integrate these with photograph they then research their tourist site and take part in an interview before writing their final article the task end with the opportunity to develop narrative writing in several way this performance task ha edition for 11 different city including san francisco honolulu and boston	0
writing for the real world our student are using social medium whether we like it or not this presentation is a useful overview of a variety of way to use social medium to provide authentic writing experience for student of all age tool are suggested	1
task card inb note and game for clothing demonstrative adjective or pronoun in this 5-hour le on demonstrative adjective or pronoun and clothing includes clear and easy- to-follow note for interactive notebook a well a 24 task card and a game for practice how can i use it to teach new learner about demonstrative adjective and pronoun to review demonstrative adjective and pronoun with learner to teach new learner about clothing to review clothing with learner a a learning station or learning center who is it for italian student at novice level and up student in grade 6-12 at the end of the lesson student will be able to identify and use demonstrative adjective and pronoun according to gender and number identify and use clothing vocabulary includes 24 page of content detailed instruction and idea for use note for inb on demonstrative adjective and pronoun and their use note for inb on clothing 24 task card to practice demonstrative and clothing with answer key dynamic game to practice demonstrative and clothing with game piece dice etc	0
ecological interaction article this article explains how a wealth and variety of specie or specie richness promotes strong ecological network and function to learn more about this course and the california academy of science please visit	0
mr harm keynote or power point presentation on stalin totalitarian govt mr harm ha designed a number of powerpoint and keynote presentation to help student understand history designed by a teacher for teacher this powerpoint focus on totalitarianism stalinist russia this presentation is designed to give student an overview of the development of russia or the soviet union under josef stalin student will be shown map animation and description of some of the major event in the development of stalin totalitarian regime the presentation is totally customizable allowing you to add your own picture graphic and animation to take what we have done even farther it come with presentation note to help you discus the subject and engage them in the development of human at le than $ 4 00 it will save you time and lay the foundation for presentation that help student understand and remember the topic include stalin russia soviet union totalitarianism authoritarian government the great purge command economy five year plan collective farm and kulaks number of slide 39 included in the presentation package 1 keynote presentation 2 power point presentation 3 text edit file of the outline of the presentation and presenter note the package is a digital download zip file of these three item we have a number of powerpoints related to modern world history these unit are proven to engage student in a way that text book and documentary can t hundred of teacher are using these lesson plan to bring history to life for student it s a unit you ll use year after year source mcdougal littel world history pattern of interaction the world at war 1900-1945 revolution and nationalism 1900-1939 chapter 30 section 2 totalitarianism stalinist russia go here to learn more	0
create avatar using google drawing this video tutorial will capture the imagination of you and your student a you learn how to use google drawing to create your own vector avatar each step of the process is clearly shown with running commentary on how to make your image detailed and streamlined student can use this video to explore basic graphic design using shape and fill tool then create image of their own design	1
late 19th century politics in this video i discus the way european government responded to political and social pressure in the late 19th century we are really gearing up for a big showdown in 1914 and this get to some of the root of the conflict visit my youtube page for more video my website ha great resource for history and government class	0
pope francis celebrates one year a year after pope francis wa elected the catholic church ha seen progressive sweeping change that bring both catholic and non-catholic to his side from internal change to social issue such a divorce and homosexuality the pope ha been addressing them publicly about this resource this resource feature a real world public radio story listening comprehension question and classroom discussion theme about listen current listen current make it easy to bring authentic voice and compelling non-fiction story to the classroom we curate the best of public radio to keep teaching connected to the real world and build student listening skill at the same time for more information and teaching idea	0
growth pattern quiz version 2 this quiz will ass the ability to take data from a graph and correctly create a data table equation verbal description and growth pattern there is another growth pattern quiz that this quiz can be given a a multiple version or a a make-up quiz	0
significance of having a sense of direction and vision in life for success this resource highlight the critical importance of having a direction in life teacher with clarity and ownership of the subject can act a beacon for their student successful life ahead understanding goal at early stage of life enables and empowers student to unwrap the gift they we are born with and accordingly choose the right path for their future	1
imperative simple present and present progressive one point grammar lesson 2 1 9 each one point grammar lesson is a ready-to-go package that enables teacher to confidently present a discrete item of grammar to student and immediately check their comprehension with an accompanying activity worksheet lesson are designed to take between 10 30 minute but are flexible and can be combined with other activity a desired this zip file contains everything you need to teach a successful lesson a powerpoint pt presentation on the focus grammar point and a one-page printable worksheet with answer key for practice the powerpoint is ready-made for teacher to present the language in a classroom and contains chart explanation example and image to support understanding of the concept the worksheet is provided in two form a a fixed pdf that can be printed out and used a is and a an editable word document that can be personalized there are a total 351 one point grammar lesson across 3 level 95 lesson are at high beginner cefr a 2 138 at intermediate cefr b 1 and 118 at high intermediate cefr b 2 each lesson is sold separately or the entire collection is available in a single package one point grammar lesson content form a part of a comprehensive grammar course element of success grammar for language learning the course help student learn grammar and remember it it cover the grammar student find when reading academic text a well a the grammar they will need to communicate in english and to write effectively chart and activity all feature authentic corpus-based language based on the 2-billion-word oxford english corpus so that student learn grammar a it is really used	0
a and an with singular count noun noun article and quantifier one point grammar lesson 1 5 4 each one point grammar lesson is a ready-to-go package that enables teacher to confidently present a discrete item of grammar to student and immediately check their comprehension with an accompanying activity worksheet lesson are designed to take between 10 30 minute but are flexible and can be combined with other activity a desired this zip file contains everything you need to teach a successful lesson a powerpoint pt presentation on the focus grammar point and a one-page printable worksheet with answer key for practice the powerpoint is ready-made for teacher to present the language in a classroom and contains chart explanation example and image to support understanding of the concept the worksheet is provided in two form a a fixed pdf that can be printed out and used a is and a an editable word document that can be personalized there are a total 351 one point grammar lesson across 3 level 95 lesson are at high beginner cefr a 2 138 at intermediate cefr b 1 and 118 at high intermediate cefr b 2 each lesson is sold separately or the entire collection is available in a single package one point grammar lesson content form a part of a comprehensive grammar course element of success grammar for language learning the course help student learn grammar and remember it it cover the grammar student find when reading academic text a well a the grammar they will need to communicate in english and to write effectively chart and activity all feature authentic corpus-based language based on the 2-billion-word oxford english corpus so that student learn grammar a it is really used	0
slope-intercept form of linear function matching game this game includes 9 set of 4 different type of card the 4 type of card are 1 graph of a linear function 2 linear function in slope-intercept form 3 y-intercept of the linear function 4 slope of the linear function cut out the card and have student find the 9 set of match	0
going for gold ela in going for gold student use information on a previous olympic game to practice informational reading and writing a member of the international olympic committee they read about the different way to measure success of country and then compare this with information on the performance of different country they present to member of the ioc before writing their final report to other committee member the task end with the opportunity to develop explanatory writing in several different way this performance task ha edition for 9 olympic game including 2014 winter olympics 2012 summer olympics and 2010 winter olympics	0
author purpose sort in this activity partner read a paragraph and determine the author purpose	0
graph a function from a rule an explanation of the concept this video provides an explanation of the concept of graphing a function from a rule this resource is from the ck-12 library	0
george washington crossing the delaware primary source material unit this ha a primary source reading about george washington crossing the delaware in addition to reading primary source material and analyzing craft structure purpose and vocabulary this allows student to use the greater context of history to synthesize the information in this lesson student create question to interview george washington about the crossing of the delaware river and the battle of trenton this lesson come with a format to help student write the question and to predict and infer how george washington would answer it also come with additional follow up question for them to think beyond the battle of trenton	0
