text	subject_id
a father legacy in thing fall apart student will analyze the father-son relationship in the novel and determine how the relationship contribute to central idea	0
dino dig standard and non-standard measurement activity center 29 page your student will have a fun with these dinosaur themed measurement activity a they learn about standard and non-standard measurement comparing size and estimating this resource contains everything you need for 5 different activity option measure estimate measure the room 2 option and size and sort note the file doe not contain standard ruler due to size inconsistency when printing you will need to provide the standard ruler if you choose to use them file includes center sign response sheet 2 option for wording-8 total 0 dino themed measurement task card dino bone ruler dinosaur size and sort card 6 different dinosaur have fun common core aligned k md a 1 k md a 2 1 md a 1 1 md a 2 2 md a 1 2 md a 2 2 md a 3	1
character education responsibility based on positive behavioral intervention and support this unit is comprised of lesson in character education 1 recognizing responsible behavior in school 2 responsible in the bathroom 3 be responsible at home 4 acting responsible different real life scenario 5 being responsible in school the objective is to ensure student will be able to identify and ass the type of responsible behavior in the school setting that will make them successful in school	1
to tell part 1 suggestion for the construction of a narrative world in italian	0
the making of the fittest excellent hhmi resource on natural selection and adaptation ng aligned includes student and teacher handout a well a hq short film	0
go math 1st grade exit ticket chapter 2 subtraction concept this essential resource includes an exit ticket for each go math common core 1st grade chapter lesson for quick and easy formative assessment this helpful time saver will allow you to monitor understanding of lesson concept to effectively plan for instruction reteach lesson and your math center student self-assess their understanding using the stoplight scale and indicate their level on the exit ticket file includes exit ticket for each chapter lesson and blank 6 per page anchor chart for display student sized anchor chart for math journal or desk common core aligned macc 1 oa 1 1 macc 1 oa 3 6 macc 1 oa 4 8 be sure to check out my other math resource	1
aerobics lesson plan aerobics lesson plan for the australian curriculum	1
how to open your locker this is a step-by-step guide with visuals to teach kid how to open a combination lock this ha been an invaluable resource for new middle school student	1
cell membrane and lt mg arc equal and amp c 2 equal 18349401 and amp cv equal 2 0 and amp ch equal 1 or and gt cell membrane power point go over the main function of the cell membrane and it component student will learn what component and biomolecules make up the cell membrane next genreation science standard conduct an investigation to provide evidence that living thing are made of cell either one cell or many different number and type of cell [ clarification statement emphasis is on developing evidence that living thing are made of cell distinguishing between living and non-living thing and understanding that living thing may be made of one cell or many and varied cell develop and use a model to describe the function of a cell a a whole and way part of cell contribute to the function [ clarification statement emphasis is on the cell functioning a a whole system and the primary role of identified part of the cell specifically the nucleus chloroplast hypochondria cell membrane and cell wall texas essential knowledge and skill in biology student in biology study a variety of topic that include structure and function of cell and virus growth and development of organism cell tissue and organ nucleic acid and genetics biological evolution taxonomy metabolism and energy transfer in living organism living system homeostasis and ecosystem and the environment	0
early childhood literary element activity worksheet this book contains ten different worksheet intended for work with literacy at the early childhood level each page is intended to give your student a chance to respond to a story in some way whether it ha to do with the plot the setting the character the problem the solution or the main idea layout and feature of the page are age-appropriate for student who need scaffolding for their emerging printing and writing content include literary element web plot diagram setting quick write and draw problem and solution organizer character quick write and draw the best part wa book cover the main idea reading reflection story retelling organizer if you enjoy this product please be sure to check out my other graphic organizer and reading response resource available at my store	0
hunting star student use celestia to classify star according to their mass and temperature the star can be graphed later and compared to star chart download celestia here	0
library idea a collect of pin that i have collected that would be helpful to any librarian	1
ethic ethic idea about research	1
information literacy 101 use fourth the digital literacy 101 program is designed to meet the state and federal requirement for cuber safety and digital literacy education based on the official california model school library standard educational code section 51871 5 for educating student and teacher on the appropriate and ethical use of education technology in the classroom and beyond this program is designed for simple implementation and provides assessment for each grade level that are aligned to california standard the grade level lesson are designed for the teacher student peer tutor and parent concurrently the lesson provide the following section student objective california school library standard 3 1 lead learner instruction assessment question suggested procedure suggested resource extension activity suggested cross-curricular integration	1
greatest common monomial factor an explanation of the concept this video provides an explanation of the concept of finding the greatest common monomial factor this resource is from the ck-12 library	0
function rule based on graph what if you we are given the coordinate graph of a function and you wanted to find the function rule shown by the graph how could you write that rule after completing this concept you will be able to create a table of value from a graph to help you write function rule like this one this resource is from the ck-12 library	0
student desk reinforcement grid this resource includes 1 desk reinforcement grid 1 individual student that can be used alongside my other spotlight resource token economy data collection form this resource is great for behavior management in the classroom a a district behavior coach and former school-based behavior specialist i relied on token economy to support behavior change with student in general education and special education setting a token economy system is designed to reinforce student acquisition of new positive or appropriate behavior typically the design of a token economy system begin with administering a reinforcement survey or interviewing the student to determine preferred reinforcer token such a sticker coin visual icon of favorite cartoon character or superheroes are created and used with a token grid such a the example provided the student is then taught the behavior s required to earn the token the behavior must be clearly communicated to the student it is best to display the appropriate behavior in both word and picture a a visual reminder of the behavior expectation s you can also write the behavior on the token grid when a specified number of token have been earned the student is able to buy or exchange the earned token for their preferred reinforcer when token economy are implemented effectively they are a strong motivator for behavior change i do not include a loss of token in the system i use	1
lymphatic system and immunity test anatomy and physiology growth test topic lymphatic system and immunity topic include lymphatic vessel thoracic duct lymph gland lymph node enzyme pathogen antibody active immunity and immunoglobulin question type multiple choice true or false short answer total question 35	0
visual poetry draw word mosaic with your poetry	0
a bad reaction balancing equation in the name of the law there wa an unexplained explosion in the lab of a college chemistry professor the professor wa severely injured the legendary detective ferrum take her team to the crime scene on a mission to find out how this could have happened the student will be required to balance chemical equation to solve the mystery	0
edmodo spotlight countdown to christmas this resource provides access to 24 digital tool or website for educator to use in the classroom i created this thinglink resource to resemble an advent calendar in support of a fun challenge i developed for spotlight each day you will be provided with a technology resource that can be used in your classroom to enhance student learning engagement and motivation utilizing technology a a tool to assist in the learning process provides student with more engaging opportunity to learn and become successful digital adult objective aligned to iste standard for teacher and student international society for technology in education equal equal teacher facilitate and inspire student learning and creativity design and develop digital-age learning experience and assessment model digital age work and learning promote and model digital citizenship and responsibility engage in professional growth and leadership equal equal student promote creativity and innovation promote collaboration and communication develop research and informational fluency skill promote problem solving critical thinking and decision-making skill model appropriate behavior and safety required of digital citizen demonstrates understanding of technology operation and concept	1
the big space shuttle preview this is a freer preview of a full length video a behind-the-scenes look at the preparation and launch of the space shuttle blast off with the astronaut on a real mission experience what it s like to like and work in outer space learn about rocket engine the launch pad astronaut training and mission control meet scientist who study our universe and visit the world s largest radio telescope a a preschool teacher for many year i ordered this along with some others for our outer space unit it almost did not get ordered because i thought it sounded too technical for 3 to 5 yr old wow what a surprise it explains everything in extremely kid friendly term in an order that make sense it us actual footage and computer animation detailed enough but not scary the kid want to watch it over and over preschooler to adult will love this video it is a keeper teacher review the big space shuttle is part of the award-winning big adventure series from little mammoth medium	1
fantasy football graphing project student must build 6 type of graph after week 10 of the season the first two are chosen for them and then the student have a list of remaining graph to choose from	0
counting with hundred chart a great resource to help teach counting and pattern among number complete with hundred chart for counting by one to ten along with an empty hundred chart for a variety of us	0
thinking skill task cpd on thinking skill	1
the age of chivalry power point and keynote presentation mr harm ha designed a number of powerpoint and keynote presentation to help student understand history designed by a teacher for teacher this powerpoint focus on the age of chivalry this presentation is designed to give student an overview of how chivalry developed in europe student will be shown map animation and description of some of the facet of chivalry the presentation is totally customizable allowing you to add your own picture graphic and animation to take what we have done even farther it come with presentation note to help you discus the subject and engage student in the event of chivalry at le than $ 3 00 it will save you time and lay the foundation for presentation that help student understand and remember the topic include glorifying war and love technology of warfare warrior role in feudal society knighthood code of chivalry knight training epic poetry number of slide 21 included in the presentation package keynote presentation power point presentation text edit file of the outline of the presentation and presenter note the package is a digital download zip file of these three item mcdougal littel world history pattern of interaction an age of exchange and encounter european middle age chapter 13 section 4 the age of chivalry go here to learn more	0
i have who ha way to show a number edition 2nd or 3rd grade 8 page this engaging and challenging math game will help your student practice problem solving and develop number sense this edition focus on various way to represent number your student will work on addition subtraction multiplication place value tally time money expanded form number line number word inch skip counting ten frame and number represented in real-world object this resource is common core aligned with 2nd and 3rd grade standard but would also be a great review for 4th grade file includes 24 game card covering various skill direction common core alignment nd grade cc math content 2 oa a 1 2 oa b 2 2 oa c 3 2 oa c 4 2 nbt a 1 2 nbt a 2 2 nbt a 3 2 nbt a 4 2 nbt b 5 2 nbt b 6 2 nbt b 7 2 nbt b 8 2 nbt b 9 2 md a 1 2 md b 16 2 md c 7 2 md c 8 rd grade cc math content 3 oa a 1 3 oa c 7 3 oa d 8 3 nbt a 1 3 nbt a 2 3 nbt a 3 3 md a 1 3 md b 4 mathematical practice make sense of problem and persevere in solving them reason abstractly and quantitatively have fun be sure to check out my other common core aligned math resource more coming soon use custom search math game in my shop	1
the big auto plant preview preview of the full-length production watch how a new car is built see a new mercedes built from the designer drawing to the final quality check learn how an engine work and see all the thousand of part that go into a new car visit the design studio and engine plant in stuttgart germany and visit the giant assembly plant in alabama even go on a wild ride on the test track i have found the big adventure series movie to be well made educational and great for keeping the attention of child age 3 to 7 the big auto plant is a movie that show how the mercedes m class series is made from start to finish though it may sound like it would not keep the interest of a child the narration of the big series movie and the way they are made work like magic i am a big fan of these movie and so are the kid i work with customer review the big auto plant is part of the award-winning big adventure series from little mammoth medium	1
superhero day of the week superhero clip art super hero clip art superhero clip art super girl clip art weekday organizational tool superhero theme digital image included 7 weekday in 8 5 x 11 printable file jpeg and pdf superhero clip art set perfect for all your kid craft project this set includes beautiful clip art of cool superhero boy and girl with hero mask and more this vector clip art set is suitable for invitation making embroidery digitizing scrapbook and all your crafting perfect for home and school usesyou may use these design in unlimited way for personal classroom and crafting and creative project including creating worksheet bulletin board activity reader digital scrapbook layout craft item etc you may use these design for commercial crafting and creative project including business card banner website a long a you flattened and combine them with other thing and create new work and give graphic credit with link to bestteachertools or ambillustrationsif you create product digital or physical on tpt or other site our commercial standard license is for 1000 item or le for extended commercial use beyond 1000 item please contact u for a mass production license you may not share resell or redistribute our product ie graphic image or paper pack collection you may not claim a your own work altered or unaltered copy-write of image remains with ambillustrations for bestteachertools you may not share resell or redistribute these design a is a a digital art file in any way this mean you may not add these image to other clip art kit digital collection etc instant download this is a digital product no physical product will be sent downloaded product are non refundable all right reserved 2015 ambillustrations for bestteachertools	1
about me passport personal information review speaking activity french this 2-hour activity feature a fun 8-page passport for student to fill out about themselves including name age birthday family and their like and dislike it also ha a place where student can earn visa by interviewing classmate and practicing asking and answering about these topic of personal information how can i use it a a fun review activity a a way to introduce the content to new student a a way to get student talking a a learning station or learning center who is it for novice level french student student in grade 6-12 at the end of the lesson student will be able to ask and answer about name ask and answer about age ask and answer about birthday ask and answer about family ask and answer about like and dislike includes 4 page of content detailed instruction and idea for use an 8-page passport for student to review and interview about personal information	0
letter bb mini-file folder word wall activity pack 13 page try the full letter aa resource for free here your student will love this alphabet mini-word wall pack it s perfect for your alphabet and phonics activity this activity pack includes everything you need to create a letter specific mini-file folder word wall differentiated writing activity and word card to add to your classroom word wall it s a great resource to get your student excited about writing and will add some novelty to your writing and word work center just print laminate copy and you are done file includes letter bb mini-file folder word wall w or folder label 10 word classroom word wall or word ring card 2 size writing activity sheet have fun common core aligned rf k 1 rf k 3 rf 1 1 rf 1 2 rf 1 3 be sure to check out my other mini-word wall resource use custom search word wall activity pack in my shop	1
word blender cvc elkonin sound box activity pack 25 page this engaging activity will help your student practice segmenting and blending cvc word and develop phonemic awareness skill each work mat feature a cvc picture elkonin box and picture cue for moving counter and blending phoneme great for tiered intervention small group and independent practice file includes direction or center sign 40 cvc elkonin work mat 8 picture for each short vowel picture key you provide the manipulative common core alignment rf k 2 rf 1 2 have fun	1
information literacy use kindergarten the digital literacy 101 program is designed to meet the state and federal requirement for cuber safety and digital literacy education based on the official california model school library standard educational code section 51871 5 for educating student and teacher on the appropriate and ethical use of education technology in the classroom and beyond this program is designed for simple implementation and provides assessment for each grade level that are aligned to california standard the grade level lesson are designed for the teacher student peer tutor and parent concurrently the lesson provide the following section student objective california school library standard 3 1 lead learner instruction assessment question suggested procedure suggested resource extension activity suggested cross-curricular integration	1
symbaloo web mix of google android and google chrome app and tool this symbolical web mix includes link to both google chrome and google android classroom help on opposite side of screen	1
life on earth extinction record sheet spreadsheet designed to go with the life on earth extinction powerpoint presentation student can easily follow along and take note on the information	0
quarterback selection ela in quarterback selection student use their favorite football team to practice opinion reading and writing in a real world context a general manager for the team they have to decide which player to draft for next season they read opinion text and review information about top player before carrying out their own research using given source they then meet with the team owner and coach and follow up with an email setting out their opinion the task end with the opportunity to develop opinion reading and writing in several way this performance task ha edition for all 32 nfl team	0
classroom discipline form use this handy discipline form to document classroom incident leading to a referral to the office this resource contains four editable discipline form 2 short form per page word document format	1
german vocabulary time of day crossword this crossword on time of day die tageszeiten is for teacher and student alike who are interested in teaching or learning german direction fill in the grid with the corresponding german word for the given text clue answer are included download and have fun	0
question with the present progressive simple present and present progressive one point grammar lesson 2 1 7 each one point grammar lesson is a ready-to-go package that enables teacher to confidently present a discrete item of grammar to student and immediately check their comprehension with an accompanying activity worksheet lesson are designed to take between 10 30 minute but are flexible and can be combined with other activity a desired this zip file contains everything you need to teach a successful lesson a powerpoint pt presentation on the focus grammar point and a one-page printable worksheet with answer key for practice the powerpoint is ready-made for teacher to present the language in a classroom and contains chart explanation example and image to support understanding of the concept the worksheet is provided in two form a a fixed pdf that can be printed out and used a is and a an editable word document that can be personalized there are a total 351 one point grammar lesson across 3 level 95 lesson are at high beginner cefr a 2 138 at intermediate cefr b 1 and 118 at high intermediate cefr b 2 each lesson is sold separately or the entire collection is available in a single package one point grammar lesson content form a part of a comprehensive grammar course element of success grammar for language learning the course help student learn grammar and remember it it cover the grammar student find when reading academic text a well a the grammar they will need to communicate in english and to write effectively chart and activity all feature authentic corpus-based language based on the 2-billion-word oxford english corpus so that student learn grammar a it is really used	0
pinterest 101 for teacher check out this video for a quick overview of how to get started using pinterest to aggregate resource for use in your classroom	1
srike it scorecard scorecard for stike it game	1
learning theory a pearl of resource on the main learning theory	1
using the past progressive simple past and past progressive one point grammar lesson 2 2 7 each one point grammar lesson is a ready-to-go package that enables teacher to confidently present a discrete item of grammar to student and immediately check their comprehension with an accompanying activity worksheet lesson are designed to take between 10 30 minute but are flexible and can be combined with other activity a desired this zip file contains everything you need to teach a successful lesson a powerpoint pt presentation on the focus grammar point and a one-page printable worksheet with answer key for practice the powerpoint is ready-made for teacher to present the language in a classroom and contains chart explanation example and image to support understanding of the concept the worksheet is provided in two form a a fixed pdf that can be printed out and used a is and a an editable word document that can be personalized there are a total 351 one point grammar lesson across 3 level 95 lesson are at high beginner cefr a 2 138 at intermediate cefr b 1 and 118 at high intermediate cefr b 2 each lesson is sold separately or the entire collection is available in a single package one point grammar lesson content form a part of a comprehensive grammar course element of success grammar for language learning the course help student learn grammar and remember it it cover the grammar student find when reading academic text a well a the grammar they will need to communicate in english and to write effectively chart and activity all feature authentic corpus-based language based on the 2-billion-word oxford english corpus so that student learn grammar a it is really used	0
voice level chart a simple voice level chart to remind student what their volume should be fully editable if you save your own copy to your google drive	1
12 for the dance floor a scaled down version of our lesson 36 for the dance floor with a similar focus on area and perimeter mathematical domain geometry number and operation the number system standard grade level 4 5 4 md 3 4 g 1 5 g 3 5 g 4 topic area perimeter square number factor grade level s fourth fifth duration approximately 1 to 2 hour resource lesson plan individual powerpoint presentation pdf activity	0
mood board resource many class require some sort of mood board for student to create to convey or communicate their meaning or mood this is a list of resource that i have used for student to support them in starting their mood board	1
