text	subject_id
nutty fun ten frame puzzle and playdoh math center your student will love these hands-on ten frame activity that help develop number sense perfect for seasonal fun contains two engaging center student work individually or in small group to match number to ten frame and build number using downplay or manipulative great for small group instruction and remediation too file includes 1 ten frame 2-part puzzle number 0-20 0 ten frame work mat for playdoh or manipulatives number 1-20 ten frame activity sheet for accountability practice or formative assessment common core aligned k cc a 1 k cc a 3 k cc b 4 1 nbt b 2 a b be sure to check out my other common core math resource	1
environmental science professional student will research this profession including educational requirement professional requirement professional economics and industry notable professional in the field and field accomplishment meteorologist geochemist physical geologist astronomer historical geologist oceanographer	0
booknotes for the scarlet letter about studymode studymode is the world largest learning community for student we we are founded in 1999 on the idea that learning is mean to be social we have built a platform for student to find to create and to share over 100m flashcard and 2m research document on common school subject studymode book note maybe you missed a class or maybe you just can not quite comprehend stream of consciousness style either way studymode com ha you covered when it come to free book note on the most widely read book in high school and college curriculum the scarlet letter book note provide professionally written book summary including character plot summary analysis of major theme and a discussion of important theme and symbol you will also find quiz discussion question and suggested reading list to enhance your understanding of the material	0
minecraft in education podcast 1 with james pike this is the first in a series of pod cast on how to get started with minecraft in the classroom from educator james pike join u a we talk about how to get started and all the creative educational thing you can do with minecraft	1
crimea vote to secede from ukraine resident of crimea which is a part of ukraine voted to secede and join neighboring russia in response citizen in the capital of ukraine are preparing to use military force to prevent any action by russia citizen are afraid that one day ukraine will lose more territory to russia about this resource this resource feature a real world public radio story listening comprehension question and classroom discussion theme about listen current listen current make it easy to bring authentic voice and compelling non-fiction story to the classroom we curate the best of public radio to keep teaching connected to the real world and build student listening skill at the same time for more information and teaching idea	0
personal rainbow clip chart help your student manage their behavior using these personal rainbow clip chart each chart includes a description of the expected behavior at each level student are responsible for clipping themselves up and down throughout the day	1
letter mm mini-file folder word wall activity pack try the full letter aa resource for free here your student will love this alphabet mini-word wall pack it s perfect for your alphabet and phonics activity this activity pack includes everything you need to create a letter specific mini-file folder word wall differentiated writing activity and word card to add to your classroom word wall it s a great resource to get your student excited about writing and will add some novelty to your writing and word work center just print laminate copy and you are done file includes letter mm mini-file folder word wall w or folder label 10 word classroom word wall or word ring card 2 size writing activity sheet have fun common core aligned rf k 1 rf k 3 rf 1 1 rf 1 2 rf 1 3 be sure to check out my other mini-word wall resource	1
google apps for educator a collection of google apps for educator to use in the classroom	1
security authentication something you know have and are	1
phonetics for beginner esl student list of sound and symbol to discover the sound of english	0
letter gg mini-file folder word wall activity pack try the full letter aa resource for free here your student will love this alphabet mini-word wall pack it s perfect for your alphabet and phonics activity this activity pack includes everything you need to create a letter specific mini-file folder word wall differentiated writing activity and word card to add to your classroom word wall it s a great resource to get your student excited about writing and will add some novelty to your writing and word work center just print laminate copy and you are done file includes letter gg mini-file folder word wall w or folder label 10 word classroom word wall or word ring card 2 size writing activity sheet have fun common core aligned rf k 1 rf k 3 rf 1 1 rf 1 2 rf 1 3 be sure to check out my other mini-word wall resource	1
what are compound sentence in this brief introductory video lesson student and teacher are exposed to the element of compound sentence this video us a combination of image text and audio narration -- -addressing a multitude of learning style this introduction is great for flipped and blended technology classroom where student can access this video when instructed to or independently to reinforce learning goal related to the four sentence type and sentence structure this lesson can be shared amongst department member and student a a companion piece to much bigger lesson related to sentence type and structure	1
fontlab font editor create and edit existing font or make your very own original font family	1
radio tower problem solving spanish version of the radio tower problem solving activity for technology education	1
bookmarking tool a collection of bookmarking tool for organizing and curating resource	1
addition and subtraction math game 4 fun and engaging addition and subtraction dice game game include a template to make your own 6-sided and 10-sided dice great for building math fact fluency	0
christianity powerpoint christianity powerpoint	0
piecewise linear graphing and symmetry activity piecewise linear graphing and symmetry activity not only do student need to know how to graph linear equation with a given domain and range they will use their symmetry skill to complete the snowflake a version without holiday clip art is also included of course an answer key is provided	0
cottie catcher worksheet used to gain information about 8 common stis	1
explore fundamental right in the indian constitution a collaborative project for grade 9 under central board of secondary education cbse india this may be used a a tool for continuous and comprehensive evaluation a part of cbse assessment in india objective to reinforce student understanding of fundamental right a guaranteed by the constitution of india to help student make real life connection with what they have learn in the classroom demonstrate how an independent judiciary help safeguard citizen right develop team play skill material required internet connection any device that can run and allow editing on google drive or doc instruction the class will be divided so that each group a 6 member with one team leader the teacher will share the google doc with the team leader who in turn will share it with each member of their team each student in the team will work on one fundamental right in the designated workspace in the doc the doc may be shared through the edmodo or google classroom platform	1
perfectly polka dot black alphabet display poster set these fun polka dot poster will help your student learn the alphabet the perfect addition to your classroom d and acute cir bulletin board or writing center i have included vowel in red and black and xx represented by x ray and fox display feature a primary polka-dot color scheme file includes 2 full page alphabet sign student-size chart color and bw have fun be sure to check out my other polka dot themed resource	1
youtube resource for education a list of youtube tool to help get school and teacher started creating their own channel and video tag youtube	1
typing web typing tutor this is a great on-line typing program there is a premium version but the free version is also great -- -it just ha a bit of advertising teacher can set up class and follow their student progress on line	1
image lesson 20 ocr gcse computing welcome to ocr gcse computing this mooc massive open online course ha been created by the cambridge-based partnership of exam board ocr cambridge university press cup and the raspberry pi foundation the course is based on ocr s gcse computing curriculum and give participant an excellent opportunity to investigate how computer work how they are used and to develop computer programming and problem-solving skill the course ha been designed for 14-16 year old but is free and open to all and can be used either a a course or a resource to support teacher video focus image explain the representation of an image a a series of pixel represented in binary explain the need for meta data to be included in the file such a height width and colour depth discus the effect of colour depth and resolution on the size of an image file and the need for compression e g jpeg and gif for more information or resource please see the course through ocr mooc or connect with me on edmodo specification reference unit a 4 51 2 1 4 statement k	0
i photo simply me the art of capturing visual imagery on your mobile device	1
overview of simple modal and phrasal modal modal one point grammar lesson 3 3 1 each one point grammar lesson is a ready-to-go package that enables teacher to confidently present a discrete item of grammar to student and immediately check their comprehension with an accompanying activity worksheet lesson are designed to take between 10 30 minute but are flexible and can be combined with other activity a desired this zip file contains everything you need to teach a successful lesson a powerpoint pt presentation on the focus grammar point and a one-page printable worksheet with answer key for practice the powerpoint is ready-made for teacher to present the language in a classroom and contains chart explanation example and image to support understanding of the concept the worksheet is provided in two form a a fixed pdf that can be printed out and used a is and a an editable word document that can be personalized there are a total 351 one point grammar lesson across 3 level 95 lesson are at high beginner cefr a 2 138 at intermediate cefr b 1 and 118 at high intermediate cefr b 2 each lesson is sold separately or the entire collection is available in a single package one point grammar lesson content form a part of a comprehensive grammar course element of success grammar for language learning the course help student learn grammar and remember it it cover the grammar student find when reading academic text a well a the grammar they will need to communicate in english and to write effectively chart and activity all feature authentic corpus-based language based on the 2-billion-word oxford english corpus so that student learn grammar a it is really used	0
typing website and resource livebinder detail for student to access our school typing program type to learn 4 by sunburst a well a typing game and activity on other platform in addition there are article for parent and teacher about the importance for student to develop efficient touch typing skill this resource will continue to develop a we find other helpful typing resource	1
robodogs robotic camp everything needed to get started and run your own camp with example of the possibility	0
home reading record student fill out their reading daily with this record it note the title author page and a parent signature enjoy	0
math behind michael jordan hangtime ted talk with hungry teacher math lesson highlighting how to calculate michael jordan hang time includes watch dig deeper think discus section	0
john muir and stickeen storytown word to preteach here are a list of word that you may want to per-teach when reading this story this wa specifically used to supplement storytown curriculum 4th grade with page number for student edition listed	0
right on schedule classroom schedule display card black polka dot this comperhensive classroom schedule display includes 72 per-programmed schedule card covering the most common school subject just print and laminate the one you need resource also includes analog and digital clock card optional use and an editable slide with generic child clip art to add additional title resource includes 2 pre-programmed schedule card header 2 size choose the size that best fit your display analog and digital clock card personalize to your schedule editable slide in powerpoint if you are looking for a particular color scheme and or or theme please contact me and i ll make it for you i am willing to edit header for no additional charge within reason please contact me at overthrown be sure to check out my other themed classroom resource additional color and theme coming soon	1
booknotes for flower for algernon about studymode studymode is the world largest learning community for student we we are founded in 1999 on the idea that learning is mean to be social we have built a platform for student to find to create and to share over 100m flashcard and 2m research document on common school subject studymode book note maybe you missed a class or maybe you just can not quite comprehend stream of consciousness style either way studymode com ha you covered when it come to free book note on the most widely read book in high school and college curriculum flower for algernon book note provide professionally written book summary including character plot summary analysis of major theme and a discussion of important theme and symbol you will also find quiz discussion question and suggested reading list to enhance your understanding of the material	0
how to teach one hour of code check out this easy how-to guide for educator teaching the hour of code we have step-by-step instruction a helpful video link to new tutorial and a template lesson plan for you to customize for your classroom what is the hour of code the hour of code is a one-hour introduction to computer science designed to demystify code and show that anybody can learn the basic anybody anywhere can try the hour of code during computer science education week dec 7-13 and every educator who sign up will receive $ 10 credit to amazon com i tune or the window store sign up your classroom at householder com	0
sentence connector list i this document provides a detailed connector list long with the translation into spanish	0
budget project instruction use with worksheet	1
your site collection in one glance a way to have your favorite web page at hand	0
woman in shakespeare william shakespeare is one of the most well-known playwright in history his story of love tragedy comedy and history written in the late 1500s have transcended the century thanks to their timeless theme and complex character author tina packer ha tracked the development of shakespeare s female character through his writing career and suggests that from romeo and juliet on shakespeare wrote unusually complex woman for his time and should be considered a proton-feminist listen to learn more about the development of these female character over his career about this resource this resource feature a real world public radio story listening comprehension question and classroom discussion theme about listen current listen current make it easy to bring authentic voice and compelling non-fiction story to the classroom we curate the best of public radio to keep teaching connected to the real world and build student listening skill at the same time for more information and teaching idea	0
go math 1st grade exit ticket chapter 4 subtraction strategy this essential resource includes an exit ticket for each go math common core 1st grade chapter lesson for quick and easy formative assessment this helpful time saver will allow you to monitor understanding of lesson concept to effectively plan for instruction reteach lesson and your math center student self-assess their understanding using the stoplight scale and indicate their level on the exit ticket file includes exit ticket for each chapter lesson and blank 6 per page anchor chart for display student sized anchor chart for math journal or desk common core aligned macc 1 oa 1 1 macc 1 oa 2 4 macc 1 oa 3 5 macc 1 oa 3 6 be sure to check out my other math resource	1
who wa martin luther ap euro bit by bit 14 this video is about martin luther and the beginning of the protestant reformation i cover his early life his challenge to the catholic church the spread of his belief and the doctrine of what would become lutheranism visit my youtube page for more video my website ha great resource for history and government class	1
primary source winston churchill we shall fight them on the beach winston churchill make one of the most powerful speech ever made during wwii a germany is attacking great britain this primary source allows for the analysis and synthesis of primary source informational text thus student will be able to fully debate the text using historical context and purpose we shall go on to the end we shall fight in france we shall fight on the sea and ocean we shall fight with growing confidence and growing strength in the air we shall defend our island whatever the cost may be we shall fight on the beach we shall fight on the landing ground we shall fight in the field and in the street we shall fight in the hill we shall never surrender winston churchill	0
physical education it more than fitness use this handout for station activity in your physical educaiton classroom	1
pee paragraph and beyond help yr 7 literature student start writing their pee paragraph and then extending them based on don john from much ado about nothing	0
balanced equation lesson 3 this screen cast walk student through a basic balance equation a they try to complete the missing digit lesson 3 in a series of 4	0
lead-up to the revolutionary war this is a unit on the event beginning with the french-indian war and culminating with the shot fired at lexington and concord to use the document please select make a copy when sharing with your student	0
oceanography google map project project exception handout this one page printable or deliverable document explains the student expectation of the oceanography google map project	0
freud defense mechanism studystack for each set of flashcard entered the studystack website generates over a dozen way for user to study the information they need to learn the variety of study activity enables user to memorize data quickly without getting bored from using a single method of study studystack enables teacher to quickly enter data once and have a dozen different activity created for their student to memorize fact this set of flashcard give example of freud defense mechanism what is identification getting your estate in order and doing other task after getting bad news from your doctor what is intellectualization you keep trying to forget a traumatic event in your life what is supression poor relationship a an adult because of a traumatic event a a child what is repression stop dating people after a bad break-up and focus on another topic what is asceticism i can not log in to my email this i pod is stupid what is projection to admit or realize that your significant other is angry with you but refuse to believe that you we are dumped what is denial minimization refusing to believe bad news what is denial simple denial arguing with your friend after getting reprimanded at work what is displacement negative working out after having a bad day at work what is displacement positive you intentionally push bad detail of an event into your unconscious what is suppression detail of a bad incident are pushed into your subconscious without you realizing it what is repression someone who like to hit people becomes an mma fighter a a career what is sublimation slamming a baseball bat to the ground after you strike out what is regression defending something or someone you hate to the extreme because of guilt what is reaction formation the teacher like them better that is why they got an a what is rationalization oh yeah you are just stupid what is regression focusing on the process of getting through a bad situation instead of getting upset over it what is intellectualization taking out frustration or anger on someone or something other than the because what is displacement refusing to admit that your physician diagnosis of cancer is correct and seeking a second opinion what is denial	1
pet rock project based learning a learning opportunity that invite student to learn about mineral in the context of adopting a mineral the site includes a resource page that ha access to resource to help student learn the content this extensive resource is adapted from enduring understanding rock can be neither created nor destroyed they are just recycled through the layer of the earth lithosphere rock are formed in many different way and from different mineral rock have different us and characteristic that help distinguish them from each other mineral can be identified using different property and some mineral are more valuable than others mining put undue burden in the environment essential question s what is the rock cycle how do rock form how doe weathering change earth s surface how doe water change earth s surface how do wind ice and gravity change earth s surface what are mineral how do they form and how can they be identified why are some rock or mineral valuable and others not doe the financial gain outweigh the environmental impact of mining standard ng ms-ess 2 -1 develop a model to describe the cycling of earth material and the flow of energy that drive this process ms-ess 3 -1 construct a scientific explanation based on evidence for how the uneven distribution of earth mineral energy and groundwater resource are the result of past and current bioscience process cc ela or literacy rst 6-8 1 cite specific textual evidence to support analysis of science and technical text rst 6-8 2 determine the central idea or conclusion of a text provide an accurate summary of the text distinct from prior knowledge or opinion rst 6-8 4 determine the meaning of symbol key term and other domain-specific word and phrase a they are used in a specific scientific or technical context relevant to grade 6 8 text and topic rst 6-8 7 integrate quantitative or technical information expressed in word in a text with a version of that information expressed visually e g in a flowchart diagram model graph or table whst 6-8 2 write informative or explanatory text to examine a topic and convey idea concept and information through the selection organization and analysis of relevant content whst 6-8 9 draw evidence from informational text to support analysis reflection and research sl 8 5 include multimedia component and visual display in presentation to clarify claim and finding and emphasize salient point mathematics ee b 6 use variable to represent number and write expression when solving a real-world or mathematical problem understand that a variable can represent an unknown number or depending on the purpose at hand any number in a specified set ee b 4 use variable to represent quantity in a real-world or mathematical problem and construct simple equation and inequality to solve problem by reasoning about the quantity	0
simple past tense quiz end of the unit test	0
industrie-beauty and substance industrie beauty and substance website ha wonderful tutorial by the beauty industry best educator	1
the reformation continues power point and keynote presentation mr harm ha designed a number of powerpoint and keynote presentation to help student understand history designed by a teacher for teacher this powerpoint focus on the reformation continues this presentation is designed to give student an overview of how the catholic church answered luther reformation with it is own reform student will be shown map animation and description detailing these event the presentation is totally customizable allowing you to add your own picture graphic and animation to take what we have done even farther it come with presentation note to help you discus the subject and engage student in the event of the reformation at le than $ 3 00 it will save you time and lay the foundation for presentation that help student understand and remember the topic include the reformation john calvin predestination geneva theocracy calvinism anabaptist catholic reformation counter-reformation ignatius of loyola council of trent number of slide 27 included in the presentation package keynote presentation power point presentation text edit file of the and presenter note the package is a digital download zip file of these three item mcdougal littel world history pattern of interaction absolutism to revolution european renaissance and reformation chapter 17 section 4 the reformation continues go here to learn more	0
the professional beauty association pretty much the most important resource for industry news including a state by state legislation watch for law and information regarding the beauty industry	1
