text	subject_id
genetics museum rubric rubric for creating a genetics museum this activity match up with the geneticist biography instruction have student bring in shoe box several day before the activity place different art supply inside the box the day of the activity have generic art supply for the entire class place student into group assign each group a different geneticist that they can research the geneticist biography will make this portion easier allow each group to choose a box they must use the box and the content in the box to create their museum this is like the food network show chopped they can use any of the class art supply but they must use their art ingredient give student 45 minute to create their museum this work best if you give them the last 45 minute of the class the next class have the student complete a walk-a-bout where they move from display to display writing down the important information about each scientist where or when they we are born and died what they did that wa important to genetics type of scientist or research and any other interesting fact this activity would be appropriate for middle school life science student or high school biology student	0
rubric for newscast lesson plan rubric for extended teacher absence lesson plan newscast	0
multiplying and dividing rational number this on line interactive lesson is a great way to have student practice their skill with multiplying and diving rational number primarily fraction the lesson is accessed through the website wizer me on which you can easily log in with a free account this lesson can be used in many different way to fit the need of your classroom it provides instruction and practice which mean it can be used to reinforce the topic or introduce it student can work on it completely independently this allows you to assign it to your class a homework or have them work on it in class while you are able to work with student individually or in small group the lesson is editable which mean you can customize it to the need of your student using the wizer me website you are able to create your own lesson or access already created lesson such a this one it allows you to assign lesson to your student in a variety of way including through google classroom it also give you the choice to have feedback automatically sent back to your student when they complete the assignment and you have full access to their submitted answer	0
critical thinking in this presentation you will develop and enhance your ability to think critically ass information and develop reasoned argument in the context of the global challenge facing society today	1
discriminant scavenger hunt a 14 station scavenger hunt activity about finding the discriminant of the quadratic formula spell wild goose chase	0
resume and cover letter development student use the edmond link to develop resume and cover letter and post them to edmond	1
wh noun clause noun clause and related form one point grammar lesson 3 12 6 each one point grammar lesson is a ready-to-go package that enables teacher to confidently present a discrete item of grammar to student and immediately check their comprehension with an accompanying activity worksheet lesson are designed to take between 10 30 minute but are flexible and can be combined with other activity a desired this zip file contains everything you need to teach a successful lesson a powerpoint pt presentation on the focus grammar point and a one-page printable worksheet with answer key for practice the powerpoint is ready-made for teacher to present the language in a classroom and contains chart explanation example and image to support understanding of the concept the worksheet is provided in two form a a fixed pdf that can be printed out and used a is and a an editable word document that can be personalized there are a total 351 one point grammar lesson across 3 level 95 lesson are at high beginner cefr a 2 138 at intermediate cefr b 1 and 118 at high intermediate cefr b 2 each lesson is sold separately or the entire collection is available in a single package one point grammar lesson content form a part of a comprehensive grammar course element of success grammar for language learning the course help student learn grammar and remember it it cover the grammar student find when reading academic text a well a the grammar they will need to communicate in english and to write effectively chart and activity all feature authentic corpus-based language based on the 2-billion-word oxford english corpus so that student learn grammar a it is really used	0
subject-verb agreement with long noun phrase noun phrase one point grammar lesson 3 9 9 each one point grammar lesson is a ready-to-go package that enables teacher to confidently present a discrete item of grammar to student and immediately check their comprehension with an accompanying activity worksheet lesson are designed to take between 10 30 minute but are flexible and can be combined with other activity a desired this zip file contains everything you need to teach a successful lesson a powerpoint pt presentation on the focus grammar point and a one-page printable worksheet with answer key for practice the powerpoint is ready-made for teacher to present the language in a classroom and contains chart explanation example and image to support understanding of the concept the worksheet is provided in two form a a fixed pdf that can be printed out and used a is and a an editable word document that can be personalized there are a total 351 one point grammar lesson across 3 level 95 lesson are at high beginner cefr a 2 138 at intermediate cefr b 1 and 118 at high intermediate cefr b 2 each lesson is sold separately or the entire collection is available in a single package one point grammar lesson content form a part of a comprehensive grammar course element of success grammar for language learning the course help student learn grammar and remember it it cover the grammar student find when reading academic text a well a the grammar they will need to communicate in english and to write effectively chart and activity all feature authentic corpus-based language based on the 2-billion-word oxford english corpus so that student learn grammar a it is really used	0
family first wellness this is a wellness project to help student work through life struggle they create flower of wellness and a pot that ha been broken and taped back together student write thing that tear family apart and hold family together on the pot	1
verb tense writing practice 3 prompt to help student practice the verb tense	0
type of manufacturing system type of manufacturing system	1
no pain no gain in no pain no gain student use fitness data of movie star to practice calculating measure of center and variability creating box plot and calculating percent of number a personal trainer they must develop an exercise program for a movie star to prepare them for their next film role this performance task ha edition for movie star including mark wahlberg hugh jackman and christian bale	0
teaching binary using cup i came up with this idea back in 2013 i give the pupil 9 cup between two and get them to create a binary-deary converter it ha been very successful in my k 3 class who then take them home to teach their parent my original tweet ha had a lot of positive response in that time	0
graphing parabola worksheet for lag 1 and lag 2 this is a worksheet for sketching the graph of a parabola by finding the solution of a quadratic equation and it is vertex	0
mother to son this is a poem analysis worksheet for mother to son by langston hughes	0
determining group trend determining group trend is a quick lab activity that student can do right after the unit of periodicity trend is introduced student determine the density of sample of lead silicon and tin which are in the same group and use their data to make some assumption about group trend a stated on the lab there are several lab out such a pearson education in the market i have modified this activity to fit my student and the material that i have on hand periodic trend or periodicity is a very challenging section for high school chemistry student the more activity and practice student can get the better they are prepared the teacher note contain some additional helpful information in addition there are several activity on spotlight on trend i use a web quest found at a one beginning activity the presentation found at is the unit i present to the student a instruction virginia standard of learning chemistry ch 1 the student will investigate and understand that experiment in which variable are measured analyzed and evaluated produce observation and verifiable data ch 2 the student will investigate and understand that the placement of element on the periodic table is a function of their atomic structure	0
airacademy 6-hour flight attendant crash course this presentation contains 150 slide that we are designed for a 6-hour crash-course for both native and non-native english speaker my target audience wa mandarin chinese speaker but these slide may be used and adapted to speaker of any language highlight user-friendly layout feel like a website fun activity and role -plays fun fact and quiz link to outside resource video included for further activity content include airacademy pdf airacademy pt airacademy pps airacademy_announcements doc video folder including remove_cat_before_flight [ a cute video of a cat on a plane ] el-al_-_up_-_flight_safety_video [ foreign language with english subtitle ] flight_attendant_rapping_the_safety_briefing_south [ great southwest airline announcement ] flight_safety [ cartoon satire of less-than-ideal passenger ] pegasus_airline_flight_safety_video [ a cool advertisement in a foreign language with the avenger ] china_chats_flight_safety_part_2 content include hour 1-3 introduction best airline stock of 2015 world s best airline 2015 airport code quiz airline code quiz flight announcement airplane model quiz quizlet air video hour 4-6 inside an airport quiz inside an airplane quiz quizlet airport vocabulary flight announcement news announcer icon problem role play more air video airline industry fun fact flight simulation in the opening slide i include information regarding my edmodo class group you a a teacher may join also have your student join or even create your own edmodo student group to help organize your class all image and video are for educational purpose only this product is a compilation of various resource in a user-friendly template freely editable by the purchaser	1
bending light explore bending of light between two medium with different induces of refraction see how changing from air to water to glass change the bending angle play with prism of different shape and make rainbow by phet interactive simulation university of colorado boulder sample learning goal explain how light bend at the interface between two medium and what determines the angle apply snell law to a laser beam incident on the interface between medium describe how the speed and wavelength of light change in different medium describe the effect of changing wavelength on the angle of refraction explain how a prism creates a rainbow	0
construction kid b you i l d math center organization and rotation set-up pack 42 page please note this is a classroom organizational tool you provide the math activity for each center this construction kid themed resource pack contains everything you need to set up a math center routine in your classroom just provide the activity this resource pack is based on the b you i l d math center concept b equal buddy game you equal using manipulatives or using math tool i equal independent reading or independent practice l equal learning number or learning with technology d equal daily practice you provide labeled bin or basket with the material needed for each center a great tool for implementing the common core resource includes b you i l d center sign b buddy game you using math tool i independent reading or independent practice l learning number or learning with technology d daily practice two type of center recording or tracking sheet journal page response form and various cover option group and center rotation card card also used for bin label clip chart rotation alternative to card rotation i have added a t for an optional teacher time in the rotation if you use guided math or small group during your math center time	1
how to submit a prize a word document showing how student can submit a prize assignment	1
robotc graphical lego mindstorms ev 3 introduction to program the robotc graphical introduction to program lego mindstorms ev 3 software includes video animation and step-by-step lesson designed to help beginner learn behavior-based programing using the lego mindstorms ev 3 hardware and robotc 4 x for lego mindstorms	0
pb student reporting lab worksheet this is all of the worksheet that accompany the curriculum	1
video design single point rubric rubric used for video design project music video feel free to make a copy and modify content to meet the need of your classroom	1
job skill unit 10 day this unit is developed to be taught to 14 plus year old student it could be implemented easily into upper middle school or lower high school level the zipped folder includes all of the following item suggested guide for teaching 35-slide powerpoint ready to be presented to student rough draft resume material availability sheet interview question discussion presentation interview group assignment job skill word search paycheck worksheet the unit a a whole discus 5 major area of job skill the law the job search your resume applying interview resource can be used individually a separate plan or together a a unit plan you are getting so much with this deal	1
slope of a line learn about the different type of slope with a game	0
geographic and spatial literacy very wide variety of resource large number of on line atlas and map historical map map making tool	1
getting started with edmodo use this power point presentation to help teach others about edmodo	1
scratch lesson 03 moving the sprite continuing on from our previous lesson we will introduce a new block of code this time it is all about movement learn how to make your sprite move by pressing the up down left or right arrow key this in turn will enable you to start making fun presentation and even game have fun scratch is a free educational programming language that wa developed by the lifelong kindergarten group at the massachusetts institute of technology mit scratch is designed to be fun educational and easy to learn it ha the tool for creating interactive story game art simulation and more scratch even ha it own paint editor and sound editor built-in you can find more information and the on line editor at	0
how to i pad guided access this sheet contains step-by-step instruction on how to set up guided access on an o 8 plus device which lock student into an app	1
adding rational number online interactive lesson this on line interactive lesson is a great way to have student practice their skill with adding rational number it cover adding integer fraction and decimal the lesson is accessed through the website wizer me on which you can easily log in with a free account this lesson can be used in many different way to fit the need of your classroom it provides instruction and practice which mean it can be used to reinforce the topic or introduce it student can work on it completely independently this allows you to assign it to your class a homework or have them work on it in class while you are able to work with student individually or in small group the lesson is editable which mean you can customize it to the need of your student using the wizer me website you are able to create your own lesson or access already created lesson such a this one it allows you to assign lesson to your student in a variety of way including through google classroom it also give you the choice to have feedback automatically sent back to your student when they complete the assignment and you have full access to their submitted answer	1
cool math game website kid of all age love this website for the variety of game	0
edmodo how to video these screen cast we are created for professional development session in my school district the topic include the edmodo app store managing apps and app launcher	1
marty the martian class activity on living v non-living student will use knowledge of characteristic and need of living thing to help defend marty the martian this activity will work for all high school biology class for honor biology class the following extension could be used split the class into 2 large group defense and prosecution the size of the class would determine how many scenario to use make sure that for leery scenario there is a prosecutor and a defense attorney if there is enough time or the teacher would like there could be a marty character that would have to answer question from prosecutor and or or defense	0
100 year ago the shot that started wwi fired 100 year ago the shot that wa heard around the world and started world war i wa fired it fatally wounded archduke franz ferdinand the heir to the austrian-hungarian throne and his wife sophie the assassin did not realize it would unleash a world war listen to this radio story to find out why about this resource this resource feature a real world public radio story listening comprehension question and classroom discussion theme about listen current listen current make it easy to bring authentic voice and compelling non-fiction story to the classroom we curate the best of public radio to keep teaching connected to the real world and build student listening skill at the same time for more information and teaching idea	0
great tech for the classroom this site share student project and idea that we actually create and use in the classroom tag classroom project	1
graph using slope-intercept form a sample application this video demonstrates a sample use of graph using slope-intercept form this is a resource from the ck-12 library	0
thanks for the meme-osier student create their own me to demonstrate their understanding of the character and theme from paulo coelho the alchemist	0
how entomologist catch insect spider and other creepy crawlies this article give an overview of the collection practice of entomologist to learn more about this course and the california academy of science please visit	0
appreciating shakespere contextualize shakespearean text distinguish between life and thought of people of shakespearean time and now distinguish between use of language during shakespearean time and now	0
mr a document by akash karia explaining how to include humor into a talk	1
using your race strategy this is a great reading strategy anchor chart for a poster mini-bookmark handout and etc in order to incorporate text connection r restate the question a answer all part of the question c connection are made text to text text to self text to world e example are cited explaining support or defense for your answer	0
java level 5 more covered the theory now practice the coding java level 5	0
proclamation of 1763 video in 1754 the idea of a great war between england and the thirteen british colony wa unthinkable yet somehow a mere 25 year later the two nation we are at irrevocable war how could this possibly happen this video explores some of the early event that led to the eventual separation of the british colony from england student will utilize this lesson to better understand the precise detail of explanation or description pertaining to the early event of the revolutionary war further they will better be able to determine the central idea of this point in history and provide an accurate summary of the event and individual involved in this complex moment in history content outline early event leading to revolutionary war french-indian war 1753-1763 albany plan for the union 1754 british debt proclamation of 1763 ohio valley 10 minute video	0
21st century portfolio this is an open google website template for student to create an on line portfolio it ha tab and link to page with activity to create a portfolio once they create their site with the template they can customize it a they would like i encourage student to write a reflection about each of their activity	1
college and career planning career and planning fewr middle grade and up this is open material that is capable few begin edited great infewrmation and visual presentation	1
college admission process college admission test in this micro-course you will learn all the aspect of two college admission test act and sat what are they which one to choose and also some strategy of passing the test	1
the school lunchroom zip a zip file containing worksheet power point and chart created with kidpix and printshop all activity are based on the ebook the school lunchroom included if software is not available download a viewer all actvities included in this zip file have been uploaded separately	0
legoself i began using this concept last year last summer the lego movie wa a pretty big deal so i asked my student to take this loge template and use it to make themselves a loge character by doing this i could see how they saw themselves and what they we are into	0
how we go home dismissal clip chart-let u hear it for hollywood this fun hollywood themed dismissal clip chart will help organize classroom procedure just assemble a shown program a clothespin with each student s name or number and attach clip to the chart to indicate how student go home make it easy for your substitute too a great visual and so easy to manage file contains several option for transportation if you need custom wording email me and i will take care of it for you overthrown be sure to check out my other classroom display and clip chart more coming soon	1
probable passage worksheet for chapter 7 section 2 glencoe biology probable passage and gist worksheet specifically for glencoe biology chapter 7 section 2 the probable passage and gist section could be altered to fit any chapter in any science text book	0
finding the slope and equation of a line the grade or slope of a road is measured in a percentage for example if a road ha a downgrade of 7 % this mean that over every 100 horizontal foot the road will slope down 7 foot vertically this resource is from the ck-12 library if a highway ha a downgrade of 12 % for 3 mile 5280 foot in a mile how much will the road drop what is the slope of this stretch of highway	0
thank a teacher letter at the end of middle school student reflect on those staff member that made a difference in their life then they write a thank you letter to that teacher click on the website link to view the material	0
privacyfix manage your online privacy the simple way to manage your on line privacy all in one place manage facebook linkedin and google privacy setting see who is tracking you	1
grammar unit sentence and fragment this is a complete unit on teaching student to differentiate between sentence and fragment it includes a link to a video four grammar warm ups or bell time and a quiz	0
prokaryote bacteria worksheet with key this proteolytic worksheet set cover archaebacteria eubacteria bacteria shape structure cluster type gram staining reproduction pasteurization sterilization and antibiotic resistance there are also example of specific bacteria pathogenic and beneficial bacteria are covered great for any state texas biology teks 4 science concept the student know that cell are the basic structure of all living thing with specialized part that perform specific function and that virus are different from cell the student is expected to a compare and contrast proteolytic and neurotic cell next generation science standardsms-ls 1 -1 conduct an investigation to provide evidence that living thing are made of cell either one cell or many different number and type of cell [ clarification statement emphasis is on developing evidence that living thing are made of cell distinguishing between living and non-living thing and understanding that living thing may be made of one cell or many and varied cell ] ms-ls 1 -2 develop and use a model to describe the function of a cell a a whole and way part of cell contribute to the function	0
making hollandaise just watch instructional video featuring several technique necessary for successful hollandaise production	1
pump it up athlete in pump it up student use real fitness training schedule to train a top player in their favorite sport and practice interpreting and solving multiplication division and word problem with time a personal trainer they have to prepare their client training plan to improve their fitness this performance task ha different edition for 11 athlete including aaron rodgers lebron james serena williams alex morgan and cristiano ronaldo	0
