text	subject_id
36 interesting way to get to know your new class this is a collection of activity from various teacher for getting to know your student from bingo to smarties to nametags this is a collection of the best and brightest idea for engaging others	1
christmas tree writing prompt activity christmas tree writing prompt activity this template wa created for a creative writing project for 1st-4th grade student the project requires student to describe and discus the use of an american christmas tradition the christmas tree student will write about the purpose and intention of this american custom a though it we are being explained to a student from another country meet va sol 2 12-a b c feel free to print and use this activity in your classroom	1
thanksgiving a collection of a variety of exercise dedicated to the thanksgiving holiday in the united state included are typical game associated for entertainment word find acrostic poem crossword puzzle and so forth	1
helmet or brain safety engineering design challenge in this engineering design challenge student are hired by a fictitious company to design a football helmet that can protect player and withstand a maximum impact speed while participating in this challenge student learn some basic fact about brain injury and gain experience in the following ng standard ms-ets 1 -1 define the criterion and constraint of a design problem with sufficient precision to ensure a successful solution taking into account relevant scientific principle and potential impact on people and the natural environment that may limit possible solution ms-ets 1 -2 evaluate competing design solution using a systematic process to determine how well they meet the criterion and constraint of the problem ms-ets 1 -3 analyze data from test to determine similarity and difference among several design solution to identify the best characteristic of each that can be combined into a new solution to better meet the criterion for success ms-ets 1 -4 develop a model to generate data for iterative testing and modification of a proposed object tool or process such that an optimal design can be achieved	0
multi-step word problem lesson 2 this screen cast model how to use critical thinking and analyzing skill to solve a multi-step word problem focused on game board	0
holiday spreadsheet project here is a little holiday fun for you and to share or you can use the non-tiny cc address if tiny cc is blocked at your district it is a google sheet that us formula function and conditional formatting to give a time reveal advent calendar it make use of following function equal today equal hyperlink equal if concatenation a usual it wa easier to use the formula version i e equal abc and and cede and ending a opposed to the equal concatenate function spoiler alert the link below will allow you to view all of the spreadsheet working but it will ruin upcoming surprise of daily gift again it wa a pleasure to work with you in boot camp and we are very impress to see and hear about the great thing you are doing with your acquired skill a always please feel free to contact eric or i to share what you are doing and or or i if you have question	1
valentine day spending decrease valentine day is the second most popular holiday right after christmas but this year valentine day spending went down compared to previous year is this a response to the war on valentine day listen to this story to find out why about this resource this resource feature a real world public radio story listening comprehension question and classroom discussion theme about listen current listen current make it easy to bring authentic voice and compelling non-fiction story to the classroom we curate the best of public radio to keep teaching connected to the real world and build student listening skill at the same time for more information and teaching idea	1
castle mendeleev-a periodic journey this fantastic and engaging ix allows student to travel through mendeleev castle identifying element from the periodic table by their property sample the next room you find yourselves in is made of a clear life-giving gas suddenly mendeleev appears again saying this element is a non metal diatomic gas that comprises about 20 % of normal air it combine with most other element to form oxide and it get thinner a you go up in the atmosphere what symbol will you carve into the door of this room student not only review their knowledge of the periodic table they also practice analysis of informational text updated digital take on the castle mendeleev activity the room are password protected a a way for student to check their work the symbol for the content of each room is the password for the next room the content of the room are al o cl s he li p si n 0- na 1- ar 2- c 3- ne 4-k 5-b 6-f 7-mg 8- h	0
matisse inspired fall tree included in this lesson is a full experience of learning about matisse and then experimenting with paper a the medium for creating art or a matiisse called it painting with scissors beginning this editable powerpoint lesson are a series of slide with visual image to introduce student to the artwork of matisse it will give student an appreciation of his use of colour and the courage he needed to create art that wa unique anything that had been done before in our time we take these kind of image for granted it will be valuable to study a few of his included work of art understand the culture of that time and to understand matisse a a person to gain a solid appreciation for his contribution to visual art following the mini-lesson about henri matisse is an editable powerpoint lesson guiding you and your class step by step through the process of painting with scissors like matisse student will be creating their own shape just a matisse did and repeatedly tracing and cutting them out to create the leaf for a fall tree in other season with different colour it can be adapted to work a well student will take their own designed shape and then experiment with different layout to design what their final product will look like before permanently gluing it in place this lesson is adaptable from grade 1-6 however a the classroom teacher you do not have to make any change to differentiate instruction student will vary by age and ability in their fine motor skill depending on these skill the intricacy of their shape will vary all result from simple oval to very detailed leaf will look very impressive a they are repeated shape and colour your only job is to gather supply that are usually already in school and read through the lesson before letting the slide guide you and your class through this great experience	1
figurative language idiom video in this brief 2 minute video we discus the figurative language term idiom we also give several popular example accompanied by illustration thanks for watching please feel free to share	0
knowledge is power mini-unit filler unit for test prep and transition into another major unit will need access to the waiting for superman documentary	0
most likely to certificate enjoy some end of the year fun with this superlative award certificate honor your student who are most likely to with this simple printable	1
edmodo spotlight countdown to christmas this resource provides access to 24 digital tool or website for educator to use in the classroom i created this thinglink resource to resemble an advent calendar in support of a fun challenge i developed for spotlight each day you will be provided with a technology resource that can be used in your classroom to enhance student learning engagement and motivation utilizing technology a a tool to assist in the learning process provides student with more engaging opportunity to learn and become successful digital adult objective aligned to iste standard for teacher and student international society for technology in education equal equal teacher facilitate and inspire student learning and creativity design and develop digital-age learning experience and assessment model digital age work and learning promote and model digital citizenship and responsibility engage in professional growth and leadership equal equal student promote creativity and innovation promote collaboration and communication develop research and informational fluency skill promote problem solving critical thinking and decision-making skill model appropriate behavior and safety required of digital citizen demonstrates understanding of technology operation and concept	1
quadratic equation workbook student will learn how to solve quadratic equation by factoring completing the square and quadratic formula there are guided practice problem for each of these three method a well a practice problem at the end of the workbook to test the student understanding of the concept solution are included	0
guide to using google hangout this interactive guide to google hangout provides you with information and resource for accessing and setting up a google hangout this resource wa created by me and uploaded into thinglink to provide you with a more interactive way to learn about google hangout	0
winter snowman poop i give a bag of mini marshmallow to my student every year with this little love note attached i have used this with student in 6th and 8th grade and even those older kid some 15 year-old 8th grader love the note and the sweet treat	1
wimbledon tennis math project a 5-6 lesson math project for on wimbledon tennis project answer the math question to find out who progress to the next round addition subtraction multiplication division negative number algebraic expression all covered	1
turkey trot math game a math game to practice addition and subtraction roll three number cube add the two highest number subtract the remaining number cube place your marker on that number if the number is already covered you lose your turn	1
mother day collection have your student create or write something for mom this mother day what you get in this 10 page mother day packet 1 mom you make me smile draw a happy face for mom 2 mother day finger word or poem 3 animal child and mother themed page to draw a picture for mom 4 world greatest mom certificate 5 mother day coupon good for _____________ student fill in the blank 6 animal themed letter to mom 3 version 7 write a short story telling how mother care for their child animal themed 2 version	1
fun with present ten frame puzzle and playdoh math center your student will love these hands-on ten frame activity that help develop number sense perfect for seasonal fun contains two engaging center student work individually or in small group to match number to ten frame and build number using downplay or manipulative great for small group instruction and remediation too file includes 21 ten frame 2-part puzzle number 0-20 20 ten frame work mat for playdoh or manipulatives number 1-20 3 ten frame activity sheet for accountability practice or formative assessment common core aligned k cc a 1 k cc a 3 k cc b 4 1 nbt b 2 a b be sure to check out my other common core math resource	1
tate game fine art game the tate housing britain national gallery of art present a variety of fun and educational game color in art historical coloring page using famous artist preferred color palette discover the fact behind a mysterious object found at tate britain see how turner included everyday element into his work and more addressing a variety of subject and skill level these game are great resource for any art class these game are flash-based so they will only work on flash enabled device	0
earthquake damage hydropower system about this resource this resource feature a real world public radio story listening comprehension question and classroom discussion theme about listen current listen current make it easy to bring authentic voice and compelling non-fiction story to the classroom we curate the best of public radio to keep teaching connected to the real world and build student listening skill at the same time for more information and teaching idea	0
winter warm-up ten frame puzzle and playdoh math center your student will love these hands-on ten frame activity that help develop number sense perfect for seasonal fun contains two engaging center student work individually or in small group to match number to ten frame and build number using downplay manipulative or dry erase great for small group instruction and remediation too file includes 21 ten frame 2-part puzzle number 0-20 20 ten frame work mat for playdoh or manipulatives number 1-20 3 ten frame activity sheet for accountability practice or formative assessment common core aligned k cc a 1 k cc a 3 k cc b 4 1 nbt b 2 a b be sure to check out my other common core math resource	1
 record a one minute video about an animal in danger of extinction include habitat location special feature and other relevant information about your animal	0
halloween webhunt a halloween web hunt for 4-8 grade student	1
easter themed math game student will practice basic addition and subtraction with this easter themed game student will roll 3 dice add the 2 highest number and then subtract the lowest number from that total student will place a game piece on their number 1st one done is the winner	1
